URL,DSLD ID,Product Name,Other Ingredients
https://dsld.od.nih.gov/label/542,542,B-2 100 mg,Dicalcium Phosphate; Vegetable Cellulose; Croscarmellose; Vegetable Magnesium Stearate; Silica; Vegetable Cellulose Coating
https://dsld.od.nih.gov/label/545,545,Niacin 250 mg,Dicalcium Phosphate; Vegetable Cellulose; Croscarmellose; Stearic Acid (C18:0); Vegetable Magnesium Stearate; Vegetable Cellulose Coating
https://dsld.od.nih.gov/label/546,546,Niacinamide 500 mg,Vegetable Cellulose; Dicalcium Phosphate; Stearic Acid (C18:0); Contains <2% of (Silica; Vegetable Magnesium Stearate)
https://dsld.od.nih.gov/label/550,550,E-Oil,Soybean Oil; Corn Oil; Sesame Oil; Wheat Germ Oil; Lemon Oil
https://dsld.od.nih.gov/label/565,565,B-6 50 mg,Dicalcium Phosphate; Vegetable Cellulose; Croscarmellose; Stearic Acid (C18:0); Silica; Vegetable Magnesium Stearate
https://dsld.od.nih.gov/label/566,566,B-12 100 mcg,Dicalcium Phosphate; Vegetable Cellulose; Mannitol; Silica; Vegetable Magnesium Stearate
https://dsld.od.nih.gov/label/567,567,Beta-Carotene Provitamin A 25000 IU,Soybean Oil; Gelatin; Vegetable Glycerin; yellow Beeswax; Soy Lecithin
https://dsld.od.nih.gov/label/568,568,Complete B Complex,Dicalcium Phosphate; Vegetable Cellulose; Croscarmellose; Silica; Calcium Silicate; Vegetable Magnesium Stearate; Vegetable Cellulose Coating; Maltodextrin; Mannitol
https://dsld.od.nih.gov/label/573,573,B-12 500 mcg,Dicalcium Phosphate; Vegetable Cellulose; Stearic Acid (C18:0); Silica; Vegetable Magnesium Stearate
https://dsld.od.nih.gov/label/574,574,Timed Release B-12 1000 mcg,Dicalcium Phosphate; Mannitol; Vegetable Cellulose; Hypromellose; Stearic Acid (C18:0); Silica; Vegetable Magnesium Stearate
https://dsld.od.nih.gov/label/582,582,Niacin 100 mg,Dicalcium Phosphate; Vegetable Cellulose; Croscarmellose; Stearic Acid (C18:0); Silica; Vegetable Magnesium Stearate; Vegetable Cellulose Coating
https://dsld.od.nih.gov/label/584,584,Beta-Carotene Provitamin A 10000 IU,Soybean Oil; Gelatin; Vegetable Glycerin; yellow Beeswax; Soy Lecithin
https://dsld.od.nih.gov/label/590,590,B-1 100 mg,Dicalcium Phosphate; Vegetable Cellulose; Stearic Acid (C18:0); Silica; Vegetable Magnesium Stearate
https://dsld.od.nih.gov/label/602,602,Timed Release B-12 1500 mg,Dicalcium Phosphate; Vegetable Cellulose; Stearic Acid (C18:0); Contains <2% of (Silica; Vegetable Magnesium Stearate)
https://dsld.od.nih.gov/label/686,686,Vitamin B-12 1500,Dicalcium Phosphate; Gelatin
https://dsld.od.nih.gov/label/843,843,Vitamin K-2,Soybean Oil; Gelatin; Glycerin; Caramel color; Titanium Dioxide
https://dsld.od.nih.gov/label/875,875,Vitamin K 100 mcg,Dicalcium Phosphate; Vegetable Cellulose; Stearic Acid (C18:0); Vegetable Magnesium Stearate
https://dsld.od.nih.gov/label/878,878,Pure Vitamin C Crystals 5000 mg,Ascorbic Acid
https://dsld.od.nih.gov/label/915,915,Inositol Powder,
https://dsld.od.nih.gov/label/928,928,Choline Bitartrate Inositol 500 mg,Vegetable Cellulose; Calcium Silicate; Stearic Acid (C18:0); Croscarmellose; Vegetable Magnesium Stearate; Vegetable Cellulose Coating
https://dsld.od.nih.gov/label/957,957,Natural E 400,Calcium Sulfate (Ca Sulfate); Gelatin
https://dsld.od.nih.gov/label/969,969,Vitamin B-12 1000,Dicalcium Phosphate; Cellulose; whole Brown Rice powder
https://dsld.od.nih.gov/label/1009,1009,B-12 1000 Cherry Flavor,Sorbitol; Mannitol; Natural and Artificial Cherry Flavor; Sucralose
https://dsld.od.nih.gov/label/1010,1010,B-12 1000 Cherry Flavor,Sorbitol; Mannitol; Natural and Artificial Cherry Flavor; Sucralose
https://dsld.od.nih.gov/label/1011,1011,B-12 1000 Cherry Flavor,Sorbitol; Mannitol; Natural and Artificial Cherry Flavor; Sucralose
https://dsld.od.nih.gov/label/1043,1043,B-12 5000 ZipMelt,Mannitol; Natural and Artificial Cherry Flavor; Sucralose
https://dsld.od.nih.gov/label/1046,1046,Vitamin D-3 800,Dicalcium Phosphate; Cellulose
https://dsld.od.nih.gov/label/1070,1070,Vitamin C 500,Cellulose
https://dsld.od.nih.gov/label/1096,1096,High Potency Vitamin C 500 mg,Vegetable Cellulose; Stearic Acid (C18:0); Vegetable Magnesium Stearate; Silica
https://dsld.od.nih.gov/label/1108,1108,Beta-Carotene 25000 IU,Soybean Oil; Gelatin; Vegetable Glycerin; yellow Beeswax; Soy Lecithin
https://dsld.od.nih.gov/label/1109,1109,Vitamin E 1000 IU,Gelatin; Vegetable Glycerin; Soybean Oil
https://dsld.od.nih.gov/label/1171,1171,100% Natural E-1000 IU,Gelatin; Vegetable Glycerin; Soybean Oil
https://dsld.od.nih.gov/label/1199,1199,Liquid Vitamin C With Wild Rose Hips,purified Water; Sucrose; Glycerin; Sorbitol; Propylene Glycol; Ascorbic Acid; Rose Hips; natural Lime flavor; Methylparaben; Propylparaben
https://dsld.od.nih.gov/label/1200,1200,Biotin 300 mcg,Dicalcium Phosphate; Vegetable Cellulose; Stearic Acid (C18:0); Croscarmellose; Silica; Vegetable Magnesium Stearate
https://dsld.od.nih.gov/label/1311,1311,Sunvite Vitamin D3 10000 IU,Safflower Oil; Gelatin; Vegetable Glycerin
https://dsld.od.nih.gov/label/1342,1342,High Potency Biotin 5 mg,Cellulose; Cellulose; Silica; Magnesium Stearate
https://dsld.od.nih.gov/label/1365,1365,Vitamin A 10000,Soybean Oil; Gelatin; Glycerin
https://dsld.od.nih.gov/label/1368,1368,Vitamin A & D-3,Soybean Oil; Gelatin; Glycerin
https://dsld.od.nih.gov/label/1370,1370,Cod Liver Oil,Soybean Oil; Gelatin; Glycerin
https://dsld.od.nih.gov/label/1377,1377,Vitamin B-12 1000,Dicalcium Phosphate; Cellulose; Vegetable Stearate; Food Glaze; whole Brown Rice powder
https://dsld.od.nih.gov/label/1399,1399,Natural Ultra E 1000,Gelatin; Soybean Oil; Glycerin; Caramel color; Titanium Dioxide
https://dsld.od.nih.gov/label/1400,1400,Natural E 400,Soybean Oil; Gelatin; Glycerin
https://dsld.od.nih.gov/label/1401,1401,Natural E 400,Soybean Oil; Gelatin; Glycerin
https://dsld.od.nih.gov/label/1402,1402,Natural E 400,Soybean Oil; Gelatin; Glycerin
https://dsld.od.nih.gov/label/1404,1404,Natural E 200,Gelatin; Soybean Oil; Glycerin
https://dsld.od.nih.gov/label/1406,1406,Natural E 1000,Gelatin; Soybean Oil; Glycerin
https://dsld.od.nih.gov/label/1407,1407,Natural E 1000,Soybean Oil; Gelatin; Glycerin
https://dsld.od.nih.gov/label/1416,1416,Vitamin K 100,Dicalcium Phosphate; Cellulose
https://dsld.od.nih.gov/label/1417,1417,Vitamin E 400,Gelatin; Glycerin
https://dsld.od.nih.gov/label/1418,1418,Vitamin C 1000 With Rose Hips,Cellulose; Vegetable Acetoglycerides; Rose Hips powder
https://dsld.od.nih.gov/label/1419,1419,Vitamin C 1000 With Rose Hips,Cellulose; Vegetable Acetoglycerides; Rose Hips powder
https://dsld.od.nih.gov/label/1420,1420,Vitamin B-12 500,Dextrose; Dicalcium Phosphate; whole Brown Rice powder
https://dsld.od.nih.gov/label/1421,1421,Vitamin B-12 500,Dextrose; Dicalcium Phosphate; whole Brown Rice powder
https://dsld.od.nih.gov/label/1422,1422,Vitamin C 500,Cellulose; Dicalcium Phosphate; Rose Hips; Vegetable Acetoglycerides
https://dsld.od.nih.gov/label/1423,1423,Vitamin C 500,Cellulose; Dicalcium Phosphate; Rose Hips; Vegetable Acetoglycerides
https://dsld.od.nih.gov/label/1424,1424,Vitamin C 500,Cellulose; Dicalcium Phosphate; Rose Hips; Vegetable Acetoglycerides
https://dsld.od.nih.gov/label/1425,1425,Beta-Carotene 15,Soybean Oil; Gelatin; Partially Hydrogenated Corn Oil; Glycerin
https://dsld.od.nih.gov/label/1435,1435,Biotin 600,Dicalcium Phosphate; Cellulose
https://dsld.od.nih.gov/label/1444,1444,Ester-E 400 IU,Gelatin; Soybean Oil; Vegetable Glycerin
https://dsld.od.nih.gov/label/1486,1486,Ultra Biotin 7500 mcg,Dicalcium Phosphate; Vegetable Cellulose; Stearic Acid (C18:0); Vegetable Magnesium Stearate
https://dsld.od.nih.gov/label/1487,1487,Ultra Biotin 7500 mcg,Dicalcium Phosphate; Vegetable Cellulose; Stearic Acid (C18:0); Vegetable Magnesium Stearate
https://dsld.od.nih.gov/label/1488,1488,Niacin 500 mg,Vegetable Cellulose; Dicalcium Phosphate; Croscarmellose; Stearic Acid (C18:0); Silica; Vegetable Magnesium Stearate; Vegetable Cellulose Coating
https://dsld.od.nih.gov/label/1603,1603,Maxi Baby Care Liquid Natural Raspberry Flavor,purified Water; Glycerin; Fructose; mixed fruit concentrate (Peach; Pear; Pineapple); Citric Acid; natural Raspberry flavor; Xanthan Gum; Potassium Sorbate; Sodium Benzoate
https://dsld.od.nih.gov/label/1607,1607,Natural VItamin E 400 IU,Gelatin; Glycerin; purified Water; Soybean Oil
https://dsld.od.nih.gov/label/1622,1622,B12 Strips 2000 mcg Winter Berry,Hydroxypropyl Methyl Cellulose; Glycerin; Stevia; modified Starch; Natural flavor; Gum Arabic; Sodium Carboxy Methyl Cellulose; Polysorbate 80; Menthol
https://dsld.od.nih.gov/label/1631,1631,Liquid B-Complex Natural Orange Flavor,purified Water; Glycerin; Citric Acid; Sodium Acid Sulfate; Natural Flavors; Sucralose; Gum Blend (modified Acacia Gum; Xanthan Gum); Potassium Sorbate; Sodium Hexametaphosphate; Sodium Benzoate; Acesulfame Potassium
https://dsld.od.nih.gov/label/1632,1632,Liquid Vitamin B-12 Natural Cherry Flavor,purified Water; Glycerin; Natural flavor; Potassium Sorbate; Sodium Hexametaphosphate; Citric Acid; Sodium Benzoate; Xanthan Gum; Sucralose; Acesulfame Potassium
https://dsld.od.nih.gov/label/1663,1663,B-12 5000 mcg,Mannitol; Artificial flavor; Stearic Acid (C18:0); Croscarmellose Sodium; Magnesium Stearate
https://dsld.od.nih.gov/label/1749,1749,Vitamin D 2000 IU,Softgel (Gelatin; Glycerin; Water); Soybean Oil
https://dsld.od.nih.gov/label/1870,1870,C-Ester Ascorbyl Palmitate 500 mg,Vegetable Cellulose; Gelatin; Contains <2% of (Silica; Vegetable Magnesium Stearate)
https://dsld.od.nih.gov/label/2171,2171,Healthy Heart Essentials,Gelatin; Soybean Oil; Glycerin; Water
https://dsld.od.nih.gov/label/2203,2203,Vitamin E Adult Gummy Vitamins,Glucose Syrup; Sucrose; Gelatin; Natural Flavors; Citric Acid; Lactic Acid; colors (Annatto extract; Blueberry juice; Carrot; Turmeric); fractionated Coconut Oil; Beeswax
https://dsld.od.nih.gov/label/2534,2534,Vitamin D3 5000 IU,Rice Flour; Gelatin; Magnesium Stearate; Silica
https://dsld.od.nih.gov/label/2948,2948,High Gamma Tocopherol 200 mg With Vitamin E,Gelatin; Glycerin; non-GMO Soybean Oil
https://dsld.od.nih.gov/label/2969,2969,Vitamin A 25000 IU,Soybean Oil; Gelatin; Glycerin; yellow Beeswax; Soy Lecithin
https://dsld.od.nih.gov/label/3030,3030,Biotin 5000 mcg,Calcium Carbonate (Ca Carbonate; CaCO3); Gelatin; Silica; Vegetable Magnesium Stearate
https://dsld.od.nih.gov/label/3040,3040,Vitamin C 500 mg,Cellulose; Croscarmellose; Stearic Acid (C18:0); Cellulose Coating; Silica; Vegetable Magnesium Stearate
https://dsld.od.nih.gov/label/3041,3041,Vitamin C 500 mg,Cellulose; Croscarmellose; Stearic Acid (C18:0); Cellulose Coating; Silica; Vegetable Magnesium Stearate
https://dsld.od.nih.gov/label/3042,3042,Biotin 1000 mcg,Dicalcium Phosphate; Cellulose; Stearic Acid (C18:0); Cellulose Coating; Vegetable Magnesium Stearate
https://dsld.od.nih.gov/label/3071,3071,Vitamin D3 1000 IU,Dicalcium Phosphate; Microcrystalline Cellulose; Silicon Dioxide (SiO2); Magnesium Stearate; Croscarmellose Sodium
https://dsld.od.nih.gov/label/3136,3136,Organic Vitamin C 120 mg,organic Rice Bran concentrate; organic Acacia Gum
https://dsld.od.nih.gov/label/3198,3198,Riboflavin,Kosher Certified Capsules (Gelatin; Water)
https://dsld.od.nih.gov/label/3241,3241,Vitamin D 1000 IU,Rice Bran Oil; Gelatin; Glycerin; purified Water
https://dsld.od.nih.gov/label/3277,3277,Advanced Beta-Carotene (Vitamin A) 25000 IU,Soybean Oil; Gelatin; Vegetable Oil; Glycerin; purified Water; yellow Beeswax
https://dsld.od.nih.gov/label/3318,3318,Multiple Vitamin Formula,Dicalcium Phosphate; Microcrystalline Cellulose; Stearic Acid (C18:0); Magnesium Stearate; Hypromellose; Magnesium Silicate; FD&C Red #40 Lake; Polyethylene Glycol; Titanium Dioxide; Mineral Oil
https://dsld.od.nih.gov/label/3558,3558,Niacinamide,Dicalcium Phosphate; Cellulose; Whole Brown Rice
https://dsld.od.nih.gov/label/3572,3572,Liquid Kid's Companion,purified Water; Brown Rice syrup; Glycerin; Natural Flavors (Cherry; Mixed Berry; Raspberry; Vanilla); Citric Acid; Ultra Green(R) Foods Concentrate (Alfalfa; Anise; Chamomile; Equisetum; Green Tea; Hesperidin; Licorice; Millefolium; Nettles; Peppermint; Plantago; Spinach); Xanthan Gum; Sodium Benzoate
https://dsld.od.nih.gov/label/3758,3758,Maximum Strength Folic Acid 800 mcg,Dicalcium Phosphate; Vegetable Cellulose; Stearic Acid (C18:0); Contains <2% of (Silica; Vegetable Magnesium Stearate)
https://dsld.od.nih.gov/label/4103,4103,B-12 1500 mcg,Dicalcium Phosphate; Vegetable Cellulose; Stearic Acid (C18:0); Contains <2% of (Silica; Vegetable Magnesium Stearate)
https://dsld.od.nih.gov/label/4106,4106,C-Time 1500 With Rose Hips,Ascorbic Acid; Vegetable Cellulose; Hypromellose; Silica; Rose Hips; Vegetable Magnesium Stearate
https://dsld.od.nih.gov/label/4153,4153,C-250 mg,Ascorbic Acid; Vegetable Cellulose; Vegetable Magnesium Stearate; Silica; Stearic Acid (C18:0)
https://dsld.od.nih.gov/label/4168,4168,E-400 IU,Gelatin; Vegetable Glycerin; Soybean Oil
https://dsld.od.nih.gov/label/4169,4169,E-400 IU Pure D-Alpha,Gelatin; Soybean Oil; Vegetable Glycerin
https://dsld.od.nih.gov/label/4172,4172,E-400 IU With DL-Alpha And Added Natural D-Alpha,Gelatin; Vegetable Glycerin; Soybean Oil
https://dsld.od.nih.gov/label/4178,4178,E-1000 IU With Dl-Alpha & Added Natural D-Alpha,Gelatin; Vegetable Glycerin; Soybean Oil
https://dsld.od.nih.gov/label/4179,4179,E-200 IU Pure Dl-Alpha,Gelatin; Vegetable Glycerin; Soybean Oil
https://dsld.od.nih.gov/label/4242,4242,High Potency B-Complex With Folic Acid Plus Vitamin C,Ascorbic Acid; Vegetable Cellulose; Dicalcium Phosphate; Niacinamide; Thiamine Hydrochloride (Thiamine HCl); Calcium D-Pantothenate (Ca D-Pantothenate; Ca Pantothenate; Calcium Pantothenate); Pyridoxine Hydrochloride (Pyridoxine HCl); Calcium Silicate; Vegetable Magnesium Stearate; Silica; Cyanocobalamin
https://dsld.od.nih.gov/label/4334,4334,Vitamin B-6 50 mg,Dicalcium Phosphate; Vegetable Cellulose; Croscarmellose; Stearic Acid (C18:0); Silica; Vegetable Magnesium Stearate
https://dsld.od.nih.gov/label/4340,4340,Vitamin A & D3,Soybean Oil; Gelatin; Vegetable Glycerin
https://dsld.od.nih.gov/label/4341,4341,Vitamin A 10000 IU,Soybean Oil; Gelatin; Vegetable Glycerin
https://dsld.od.nih.gov/label/4342,4342,Vitamin B-1 100 mg,Dicalcium Phosphate; Vegetable Cellulose; Stearic Acid (C18:0); Silica; Vegetable Magnesium Stearate
https://dsld.od.nih.gov/label/4358,4358,Time Released Vitamin C-1000 mg Plus Rose Hips,Ascorbic Acid; Hypromellose; Vegetable Cellulose; Contains <2% of (Rose Hips; Silica; Stearic Acid; Vegetable Magnesium Stearate)
https://dsld.od.nih.gov/label/4360,4360,Vitamin C-1000 mg Plus Rose Hips,Ascorbic Acid; Vegetable Cellulose; Rose Hips; Vegetable Magnesium Stearate; Silica
https://dsld.od.nih.gov/label/4362,4362,Vitamin C-500 mg Plus Rose Hips,Ascorbic Acid; Vegetable Cellulose; Rose Hips; Stearic Acid (C18:0); Silica; Vegetable Magnesium Stearate
https://dsld.od.nih.gov/label/4639,4639,Fast-Absorbing Liquid Vitamin D3 with ConcenTrace Tropical Cherry,purified Water; peach concentrate; Natural Vegetable Glycerine; natural flavors blend (Cherry; Citrus); Citric Acid; Xanthan Gum; Potassium Sorbate; Potassium Benzoate
https://dsld.od.nih.gov/label/4750,4750,Folic Acid,Cellulose; Magnesium Stearate
https://dsld.od.nih.gov/label/4767,4767,Opti-D3,L-Leucine; Hydroxypropylmethylcellulose
https://dsld.od.nih.gov/label/4837,4837,Vitamin E 200 IU,Gelatin; Vegetable Glycerin; Soybean Oil
https://dsld.od.nih.gov/label/4838,4838,Vitamin C 500 mg,Vegetable Cellulose; Stearic Acid (C18:0); Vegetable Magnesium Stearate; Silica
https://dsld.od.nih.gov/label/4896,4896,Vitamin A 10000 IU Vitamin D3 400 IU,Soybean Oil; Gelatin; Vegetable Glycerin
https://dsld.od.nih.gov/label/4897,4897,Sublingual B12 5000 mcg,Mannitol; Crospovidone; Stearic Acid (C18:0); Natural flavor; Contains <2% of: (Beet Juice; Sucralose; Vegetable Magnesium Stearate)
https://dsld.od.nih.gov/label/4933,4933,Methyl B-12 3000 mcg,Fructose; Mannitol; Sorbitol; Dextrose; natural Cherry flavor; luo han guo fruit extract; Magnesium Stearate; Vegetable Stearin; Silica
https://dsld.od.nih.gov/label/4934,4934,Vitamin D-3 2000 IU,Gelatin; Glycerin; Water; Soy bean Oil
https://dsld.od.nih.gov/label/4935,4935,Vitamin D-3 2000 IU,Gelatin; Glycerin; Water; Soy bean Oil
https://dsld.od.nih.gov/label/4942,4942,Perfect E,Gelatin; Glycerin; Water
https://dsld.od.nih.gov/label/4994,4994,Chewable Vita-C100 mg,Sorbitol; ROSEHIPS POWDER; natural Lemon flavor; Lemon Bioflavonoid; Hesperidin Complex; Orange Bioflavonoid; Hydroxypropyl Methylcellulose; Grapefruit Bioflavonoid; Grapefruit Oil
https://dsld.od.nih.gov/label/5003,5003,B-Complex,Microcrystalline Cellulose; TORULA YEAST; Brewer's Yeast; Hydroxypropyl Methylcellulose; Croscarmellose Sodium; hydroxylated Soy Lecithin
https://dsld.od.nih.gov/label/5004,5004,B-Complex,Microcrystalline Cellulose; TORULA YEAST; Brewer's Yeast; Hydroxypropyl Methylcellulose; Croscarmellose Sodium; hydroxylated Soy Lecithin
https://dsld.od.nih.gov/label/5027,5027,Vita-D3,Dicalcium Phosphate; Microcrystalline Cellulose; Hydroxypropyl Methylcellulose; Croscarmellose Sodium; Carnauba Wax; hydroxylated Soy Lecithin
https://dsld.od.nih.gov/label/5462,5462,E-1000,Gelatin; lecithin (soya); Water
https://dsld.od.nih.gov/label/5519,5519,Nutri-Calm,Schisandra; Choline (Choline Bitartrate); Inotisol; Bee Pollen; Para Aminobenzoic Acid (PABA); Lemon Bioflavonoid extract; Valerian root extract (Calcium D-Pantothenate); Passionflower flowers extract; hops flowers extract; Di-Calcium Phosphate; Cellulose (Plant Fiber); Stearic Acid (C18:0); Silicon Dioxide (Silica); Magnesium Stearate
https://dsld.od.nih.gov/label/5805,5805,Folic Acid Xtra,Dextrose; Vegetable Cellulose; Silica; Vegetable Magnesium Stearate; Titanium Dioxide color; FD&C Yellow # 5 Lake; FD&C Yellow # 6 Lake
https://dsld.od.nih.gov/label/5945,5945,Benfotiamine,Microcrystalline Cellulose; HPMC; Dicalcium Phosphate; Stearic Acid (C18:0); Magnesium Stearate; Silica
https://dsld.od.nih.gov/label/6008,6008,C & E Complex,Gelatin; Glycerin; Soybean Oil; Soy Lecithin; yellow Beeswax; Caramel color
https://dsld.od.nih.gov/label/6012,6012,High Potency B12 250 mcg,Dicalcium Phosphate; Vegetable Cellulose; Stearic Acid (C18:0); Silica; Vegetable Magnesium Stearate
https://dsld.od.nih.gov/label/6015,6015,Preservative Free Vitamin E 400 IU With Natural D-Alpha,Gelatin; Vegetable Glycerin; Soybean Oil; Soybean Oil
https://dsld.od.nih.gov/label/6020,6020,100% Natural Vitamin E 400 IU,Gelatin; Soybean Oil; Soybean Oil; Vegetable Glycerin
https://dsld.od.nih.gov/label/6021,6021,100% Natural Vitamin E 200 IU,Gelatin; Soybean Oil; Soybean Oil; Vegetable Glycerin
https://dsld.od.nih.gov/label/6022,6022,100% Natural Vitamin E 400 IU,Gelatin; Soybean Oil; Soybean Oil; Vegetable Glycerin
https://dsld.od.nih.gov/label/6023,6023,100% Natural Vitamin E 400 IU,Gelatin; Soybean Oil; Soybean Oil; Vegetable Glycerin
https://dsld.od.nih.gov/label/6029,6029,Super Potency Vitamin E 1000 IU,Gelatin; Vegetable Glycerin; Soybean Oil; Soybean Oil
https://dsld.od.nih.gov/label/6030,6030,Super Potency Vitamin E 1000 IU,Gelatin; Vegetable Glycerin; Soybean Oil; Soybean Oil
https://dsld.od.nih.gov/label/6064,6064,High Potency B & C Complex,Hypromellose; Dicalcium Phosphate; Vegetable Cellulose; Silica; Vegetable Magnesium Stearate
https://dsld.od.nih.gov/label/6095,6095,High Potency B1 100 mg,Dicalcium Phosphate; Vegetable Cellulose; Stearic Acid (C18:0); Silica; Vegetable Magnesium Stearate
https://dsld.od.nih.gov/label/6221,6221,Homocystrol,Mannitol/fructose complex; Cellulose; Cherry flavor; Vegetable Stearate; Vegetable Stearate; Vegetable Stearate; Silica
https://dsld.od.nih.gov/label/6266,6266,Vitamin A 10000 IU,Capsule (Gelatin); Glycerin; Soybean Oil; Soybean Oil
https://dsld.od.nih.gov/label/6279,6279,Vitamin E 400 IU Plus Mixed Tocopherols,Capsule (Gelatin); Glycerin; Soybean Oil; D-Beta Tocopherol; D-Gamma-Tocopherol; D-Delta-Tocopherol; purified Water
https://dsld.od.nih.gov/label/6280,6280,Vitamin E 1000 IU Plus Mixed Tocopherols,Gelatin; Glycerin; Soybean Oil; Water; D-Gamma-Tocopherol; D-Delta-Tocopherol; D-Alpha-Tocopherol; D-Beta Tocopherol
https://dsld.od.nih.gov/label/6286,6286,Vitamin D3 1000 IU,Rice Bran Oil; Gelatin; Glycerin; purified Water; purified Water; purified Water
https://dsld.od.nih.gov/label/6287,6287,Vitamin D3 5000 IU,Cellulose; modified Cellulose Gum; modified Cellulose Gum; Silicon Dioxide (SiO2); Stearic Acid (C18:0); Magnesium Stearate
https://dsld.od.nih.gov/label/6288,6288,Vitamin D3 2000 IU,Rice Bran Oil; Gelatin; Glycerin; purified Water; purified Water; purified Water
https://dsld.od.nih.gov/label/6289,6289,Vitamin E 200 IU Plus Mixed Tocopherols,Soybean Oil; Gelatin; Glycerin; Water; D-Gamma-Tocopherol; D-Delta-Tocopherol; D-Alpha-Tocopherol; D-Beta Tocopherol
https://dsld.od.nih.gov/label/6290,6290,Vitamin E 400 IU,Capsule (Gelatin); Glycerin; Vegetable oil; Vegetable Oil
https://dsld.od.nih.gov/label/6338,6338,Vegetarian Vitamin E 400 IU,Capsule; ETHYL CELLULOSE; Magnesium Stearate
https://dsld.od.nih.gov/label/6342,6342,Vitamin C 500 mg,Cellulose; Stearic Acid (C18:0); Silica; modified Cellulose Gum; modified Cellulose Gum; Calcium Stearate
https://dsld.od.nih.gov/label/6352,6352,All Day C 500 mg,Capsule (Gelatin); Food Glaze; Rutin; Hesperidin
https://dsld.od.nih.gov/label/6362,6362,Niacin 500 mg,Modified Cellulose; Modified Cellulose; Cellulose; Stearic Acid (C18:0); Silica; modified Cellulose Gum; modified Cellulose Gum; Magnesium Stearate; Glycerin
https://dsld.od.nih.gov/label/6366,6366,Folic Acid 800 mcg,Calcium Stearate; Cellulose; Lactose (Milk)
https://dsld.od.nih.gov/label/6369,6369,Natural Berry Flavor Methyl B-12 1000 mcg,Sorbitol; Xylitol; Cellulose; modified Cellulose Gum; modified Cellulose Gum; Silicon Dioxide (SiO2); Stearic Acid (C18:0); natural Raspberry powder; natural Strawberry flavor; Citric Acid; Magnesium Stearate
https://dsld.od.nih.gov/label/6370,6370,Biotin 500 mcg,Capsule (Gelatin); Cellulose; Silicon Dioxide (SiO2); Magnesium Stearate
https://dsld.od.nih.gov/label/6382,6382,B-12 Lozenge 1000 mcg,Mannitol; Sorbitol; natural Raspberry flavor; modified Cellulose Gum; modified Cellulose Gum; Citric Acid; Magnesium Stearate; Silicon Dioxide (SiO2)
https://dsld.od.nih.gov/label/6463,6463,Vitamin D3 400 IU,Capsule (Gelatin); Glycerin; Soybean Oil
https://dsld.od.nih.gov/label/6668,6668,Vitamin D3 2000 IU,soy bean oil; Vegetable Glycerine; Vegetable Glycerine; purified Water; purified Water; purified Water; Gelatin
https://dsld.od.nih.gov/label/6669,6669,Delta Pro Tocotrienols 125 mg,Gelatin; Glycerin; Water
https://dsld.od.nih.gov/label/6684,6684,Biotin 5000 mcg,Gelatin; Water; Cellulose; Magnesium Stearate; Vegetable Stearin; Silica
https://dsld.od.nih.gov/label/6808,6808,Vitamin D3,organic Brown Rice Flour; Gelatin
https://dsld.od.nih.gov/label/6885,6885,Natural Vitamin E,Soybean Oil; Gelatin; Glycerin; purified Water
https://dsld.od.nih.gov/label/6889,6889,Natural Vitamin E Complex,Gelatin; Glycerin; Soybean Oil; purified Water
https://dsld.od.nih.gov/label/6905,6905,Kid's Stuff,Fructose; Dextrose; Honey powder; Orange Juice Flavor Powder; Sodium Ascorbate; Papaya powder; Orange Flavor Powder; Magnesium Stearate; Silica
https://dsld.od.nih.gov/label/6922,6922,Pantothenic Acid 500 mg,Magnesium Stearate; Cellulose; Vegetable Stearin; Dicalcium Phosphate; Silica
https://dsld.od.nih.gov/label/6955,6955,Stress Formula,Dicalcium Phosphate; Microcrystalline Cellulose; Stearic Acid (C18:0); Silica; Magnesium Stearate; Croscarmellose Sodium; Pharmaceutical Glaze
https://dsld.od.nih.gov/label/6969,6969,Vitamin C-1000 With Rose Hips,Magnesium Stearate; Cellulose; Vegetable Stearin; Dicalcium Phosphate; Silica
https://dsld.od.nih.gov/label/6994,6994,Beta Carotene 25000 IU,Gelatin; Glycerin; Water; May contain: (Beeswax; Soybean Oil)
https://dsld.od.nih.gov/label/6998,6998,Biotin 5000 mcg,Gelatin; Glycerin; Water; May contain one or more of the following: (Cellulose; Magnesium Stearate; Silica; Vegetable Stearin)
https://dsld.od.nih.gov/label/7017,7017,Millguard,Dicalcium Phosphate; Microcrystalline Cellulose; Croscarmellose Sodium; Stearic Acid (C18:0); Magnesium Stearate; Silica; film coat ingredients (Hydroxypropyl Cellulose; Hypromellose)
https://dsld.od.nih.gov/label/7067,7067,Natural Source Vitamin B-1 250 mg,Dicalcium Phosphate; Microcrystalline Cellulose; Croscarmellose Sodium; Stearic Acid (C18:0); Magnesium Stearate
https://dsld.od.nih.gov/label/7087,7087,Folic Acid 800 mcg With 25 mcg Vitamin B-12,Magnesium Stearate; Cellulose; Vegetable Stearin; Dicalcium Phosphate; Silica
https://dsld.od.nih.gov/label/7132,7132,Super B-12 5000 mcg,Cane juice crystals; Natural flavors; Citric Acid; Vegetable Stearate; Silica; Ginseng Blend (American Ginseng root extract; Korean Ginseng root extract)
https://dsld.od.nih.gov/label/7147,7147,Vitamin C-1000,Microcrystalline Cellulose; Stearic Acid (C18:0); Silica; Magnesium Stearate; Croscarmellose Sodium; Pharmaceutical Glaze
https://dsld.od.nih.gov/label/7179,7179,Niacin Vitamin B-3 100 mg,Magnesium Stearate; Cellulose; Vegetable Stearin; Dicalcium Phosphate; Silica
https://dsld.od.nih.gov/label/7213,7213,Perfect E,Gelatin; Glycerin; Water
https://dsld.od.nih.gov/label/7232,7232,Natural Vitamin E-100,Soybean Oil; Gelatin; purified Water; Glycerin
https://dsld.od.nih.gov/label/7233,7233,Natural Vitamin E-200,Gelatin; Glycerin; purified Water
https://dsld.od.nih.gov/label/7236,7236,Natural Vitamin E-400,Soybean Oil; Gelatin; Glycerin; purified Water
https://dsld.od.nih.gov/label/7240,7240,Vitamin E-200,Gelatin; Glycerin; purified Water
https://dsld.od.nih.gov/label/7253,7253,Vitamin A 25000 IU,Soybean Oil; Softgel Capsule (Gelatin; Glycerin; Water)
https://dsld.od.nih.gov/label/7254,7254,Vitamin D-3 400 IU,Gelatin; Glycerin; Water
