URL,DSLD ID,Product Name,Other Ingredients
https://dsld.od.nih.gov/label/13678,13678,High Potency Sublingual Vitamin B 12 2500 mcg,Mannitol; Crospovidone; Beet; Natural flavor; Vegetable Magnesium Stearate; Sucralose
https://dsld.od.nih.gov/label/13690,13690,Vitamin B-5 (Pantothenic Acid) 500 mg,Gelatin; Cellulose; Stearic Acid (C18:0); Magnesium Stearate
https://dsld.od.nih.gov/label/14248,14248,Pantothenic Acid 500 mg,Cellulose; Stearic Acid (C18:0); Magnesium Stearate; Cellulose & Glycerin Coating; Silica; Vegetable Glaze
https://dsld.od.nih.gov/label/14319,14319,E-1000,Softgel Capsule (Gelatin; Glycerin; Water); Vegetable Oil concentrate
https://dsld.od.nih.gov/label/14558,14558,Gamma E Tocopherols,Softgel Capsule (Gelatin; Glycerin; Water); Soybean Oil
https://dsld.od.nih.gov/label/16899,16899,Bang! B12,Honey; Mannitol; Microcrystalline Cellulose; Dicalcium Phosphate; Xylitol; Orange juice powder; Stearic Acid (C18:0); Natural flavor; Silicon Dioxide (SiO2)
https://dsld.od.nih.gov/label/17060,17060,Super B Complex,Microcrystalline Cellulose; Dextrose; Stearic Acid (C18:0); Silicon Dioxide (SiO2)
https://dsld.od.nih.gov/label/17092,17092,E-400IU,Gelatin; Vegetable Glycerin; Soybean Oil
https://dsld.od.nih.gov/label/17116,17116,Vitamin C-500 mg,Ascorbic Acid; Vegetable Cellulose; Contains <2% of (Silica; Stearic Acid; Vegetable Magnesium Stearate)
https://dsld.od.nih.gov/label/17124,17124,E-400IU Pure Dl-Alpha,Gelatin; Vegetable Glycerin; Soybean Oil
https://dsld.od.nih.gov/label/17134,17134,Water-Dispersible E-400 IU With Dl-Alpha,Gelatin; Glycerin; Contains <2% of: (Citric Acid; Monoglycerides and Diglycerides; Polysorbate 80; Propyl Gallate; Propylene Glycol; Soybean Oil)
https://dsld.od.nih.gov/label/17187,17187,Vitamin C-500 mg with Rose Hips,Cellulose; Vegetable Stearin; Cellulose Gum; Silica; Magnesium Stearate
https://dsld.od.nih.gov/label/17189,17189,Vitamin C-500 mg with Rose Hips,Cellulose; Vegetable Stearin; Cellulose Gum; Silica; Magnesium Stearate
https://dsld.od.nih.gov/label/17191,17191,Vitamin C-500 mg with Rose Hips,Cellulose; Vegetable Stearin; Cellulose Gum; Silica; Magnesium Stearate
https://dsld.od.nih.gov/label/17194,17194,Sustained Release Vitamin C-1000 mg with Rose Hips,Vegetable Stearin; Cellulose; Silica; Magnesium Stearate
https://dsld.od.nih.gov/label/17286,17286,Poly-Vi-Sol,Glycerin; Water; Ascorbic Acid; Polysorbate 80; Vitamin E Succinate; Niacinamide; Ferrous Sulfate; Natural and Artificial flavor; ARTIFICIAL CARAMEL COLOR; Vitamin A Palmitate; Thiamine Hydrochloride (Thiamine HCl); RIBOFLAVIN-5-PHOSPHATE SODIUM; VITAMIN B6 HYDROCHLORIDE; Vitamin D3
https://dsld.od.nih.gov/label/17290,17290,Tri-Vi-Sol,Glycerin; Water; Polysorbate 80; Ascorbic Acid; Natural and Artificial flavor; ARTIFICIAL CARAMEL COLOR; Vitamin A Palmitate; Vitamin D3
https://dsld.od.nih.gov/label/17731,17731,Elevera,
https://dsld.od.nih.gov/label/17744,17744,Endur-Amide Sustained Release NIacinamide 500 mg,Carnauba Wax; Vegetable Stearine (Soybeans); Magnesium Stearate; Silica
https://dsld.od.nih.gov/label/17745,17745,Sustained Release Endur-C With Rose Hips 500 mg,Carnauba Wax; Vegetable Stearine (Soybeans); Magnesium Stearate; Silica
https://dsld.od.nih.gov/label/17747,17747,Sustained Release Endur-C with Rose Hips 1000 mg,Carnauba Wax; Magnesium Stearate; Stearic Acid (C18:0); Silica
https://dsld.od.nih.gov/label/17756,17756,Endur-Amide Sustained Release Niacinamide 250 mg,Carnauba Wax; Vegetable Stearine (Soybeans); Magnesium Stearate; Silica
https://dsld.od.nih.gov/label/17770,17770,Vitamin D Yummy Berry Flavor,Glucose; Sucrose; Citris Pectin; Citric Acid; Sodium Citrate; Ascorbic Acid; Black Carrot concentrate; Raspberry Flavors; Beta-Carotene
https://dsld.od.nih.gov/label/17773,17773,Vitamin C Yummy Orange Flavor,Glucose; Fructose; citrus pectin; Citric Acid; Beta-Carotene; Natural flavors; rose hips extract
https://dsld.od.nih.gov/label/17775,17775,Multi Vitamin + Mineral Formula Yummy Grape Flavor,Glucose; Sucrose; Citrus Pectin; Citric Acid; Sodium (Na); Sodium Citrate; Elderberry concentrate; Black Carrot concentrate; Grape flavor
https://dsld.od.nih.gov/label/18015,18015,Gummy Vitamins Orange Flavor,Corn Syrup; Gelatin; Lactic Acid; Ascorbic Acid; Natural flavor; Natural Mandarin Orange Color (Fruits; Vegetables)
https://dsld.od.nih.gov/label/18140,18140,Vitamin C 250 mg Orange Flavored Gummies,Glucose Syrup; Pectin; Citric Acid; Lactic Acid; Natural flavor; Color added (Annatto)
https://dsld.od.nih.gov/label/18247,18247,Psyllium Hulls,Capsule (kosher Gelatin; Water)
https://dsld.od.nih.gov/label/18553,18553,Cintron Liquid Energy Citrus Mango,CARBONATED WATER; Cane Sugar; Citric Acid; Sodium Citrate; Taurine; Glucuronolactone; Natural flavors; Caffeine; SODIUM BENZOATE; POTASSIUM SORBATE; Inositol; Niacinamide (Vitamin B3); GUM ACACIA; FD&C YELLOW #6; ESTER GUM; Calcium D-Pantothenate (Vitamin B5); Pyridoxine Hydrochloride (Vitamin B6); Cyanocobalamin (Vitamin B12)
https://dsld.od.nih.gov/label/18556,18556,Cintron Liquid Energy Cranberry Splash,CARBONATED WATER; Cane Sugar; Citric Acid; Sodium Citrate; Taurine; Glucuronolactone; Natural flavors; Caffeine; SODIUM BENZOATE; POTASSIUM SORBATE; Inositol; Niacinamide (Vitamin B3); FD&C RED #40; BLUE #1; Calcium D-Pantothenate (Vitamin B5); Pyridoxine Hydrochloride (Vitamin B6); Cyanocobalamin (Vitamin B12)
https://dsld.od.nih.gov/label/18557,18557,Cintron Liquid Energy Original,CARBONATED WATER; Cane Sugar; Citric Acid; Sodium Citrate; Caramel color; Taurine; Natural flavors; Caffeine; SODIUM BENZOATE; POTASSIUM SORBATE; Inositol; Niacinamide (Vitamin B3); Glucuronolactone; Calcium D-Pantothenate (Vitamin B5); Pyridoxine Hydrochloride (Vitamin B6); Cyanocobalamin (Vitamin B12)
https://dsld.od.nih.gov/label/18558,18558,Sugar Free Cintron Tropical Azul,CARBONATED WATER; Citric Acid; Sodium Citrate; Taurine; Glucuronolactone; Natural flavors; Caffeine; SODIUM BENZOATE; POTASSIUM SORBATE; Inositol; Niacinamide (Vitamin B3); GUM ACACIA; FD&C BLUE #1; ESTER GUM; Sucralose; Acesulfame Potassium; Calcium D-Pantothenate (Vitamin B5); Pyridoxine Hydrochloride (Vitamin B6); Cyanocobalamin (Vitamin B12)
https://dsld.od.nih.gov/label/18895,18895,Folic Acid 800 mcg With Vitamin B-12,Magnesium Stearate; Cellulose; Vegetable Stearin; Dicalcium Phosphate; Silica
https://dsld.od.nih.gov/label/19002,19002,Melatonin 3 mg With Vitamin B-6,Magnesium Stearate; Cellulose; Vegetable Stearin; Dicalcium Phosphate; Silica
https://dsld.od.nih.gov/label/19006,19006,Niacin 100 mg Vitamin B-3,Magnesium Stearate; Cellulose; Vegetable Stearin; Dicalcium Phosphate; Silica
https://dsld.od.nih.gov/label/19007,19007,Niacin Long Acting Vitamin B-3 500 mg,Vegetable Stearin; Cellulose; Silicon Dioxide (SiO2); Magnesium Stearate
https://dsld.od.nih.gov/label/19009,19009,Niacin No-Flush 400 mg,Gelatin; May contain one or more of the following (Magnesium Stearate; Rice powder; Silica)
https://dsld.od.nih.gov/label/19012,19012,Pantothenic Acid 500 mg,Magnesium Stearate; Cellulose; Vegetable Stearin; Dicalcium Phosphate; Silica
https://dsld.od.nih.gov/label/19018,19018,Vitamin C Supplement Assorted Citrus Flavor,Corn Syrup; Sodium Ascorbate; Citric Acid; Natural flavors; Ascorbic Acid; Beta-Carotene; YELLOW 6; Red 40; Water
https://dsld.od.nih.gov/label/19045,19045,Vitamin A & D 10000 IU & 400 IU,Gelatin; Glycerin; Water; May contain (Beeswax; Soybean Oil)
https://dsld.od.nih.gov/label/19047,19047,Vitamin B-1 Thiamine 100 mg,Cellulose; Vegetable Stearate; Silica
https://dsld.od.nih.gov/label/19049,19049,Vitamin B-12 Cyanocobalamin 500 mcg,Magnesium Stearate; Cellulose; Vegetable Stearin; Dicalcium Phosphate; Calcium Sulfate (Ca Sulfate); Silica
https://dsld.od.nih.gov/label/19050,19050,Vitamin B-2 Riboflavin 100 mg,Cellulose; Gelatin; Vegetable Stearate
https://dsld.od.nih.gov/label/19051,19051,Vitamin B-6 Pyridoxine 100 mg,Dicalcium Phosphate; Cellulose; Vegetable Stearin; Magnesium Stearate; Silica
https://dsld.od.nih.gov/label/19059,19059,Natural Super B-Complex,Microcrystalline Cellulose; Croscarmellose Sodium; Magnesium Stearate; Coating (Dextrin; Dextrose; Sodium Carboxymethylcellulose; Sodium Citrate; Soy Lecithin); Natural flavor
https://dsld.od.nih.gov/label/19061,19061,Natural Super B-Complex,Microcrystalline Cellulose; Croscarmellose Sodium; Magnesium Stearate; Coating (Dextrin; Dextrose; Sodium Carboxymethylcellulose; Sodium Citrate; Soy Lecithin); Natural flavor
https://dsld.od.nih.gov/label/19064,19064,Natural Super B-Complex,Microcrystalline Cellulose; Croscarmellose Sodium; Magnesium Stearate; Coating (Dextrin; Dextrose; Sodium Carboxymethylcellulose; Sodium Citrate; Soy Lecithin); Natural flavor
https://dsld.od.nih.gov/label/19083,19083,Vitamin D 1000 IU,Cellulose; Silica; Vegetable Stearate
https://dsld.od.nih.gov/label/19085,19085,Vitamin E 1000IU Natural With Mixed Tocopherols,Gelatin; Glycerin; Water; May contain (Beeswax; Soybean Oil)
https://dsld.od.nih.gov/label/19086,19086,Vitamin E 200IU Natural With Mixed Tocopherols,Gelatin; Glycerin; Water; May contain (Beeswax; Soybean Oil)
https://dsld.od.nih.gov/label/19087,19087,Vitamin E 400IU Natural With Mixed Tocopherols,Gelatin; Glycerin; Water; May contain (Beeswax; Soybean Oil)
https://dsld.od.nih.gov/label/19115,19115,B6 B12 Folic Acid Energy Boost Liquid Vitamin,purified Water; D-GLUCITOL; Pyridoxine Hydrochloride (Vitamin B6); natural Orange flavor; GRAPEFRUIT EXTRACT; Cyanocobalamin (Vitamin B12)
https://dsld.od.nih.gov/label/19140,19140,Vitamin D3,Soybean Oil; Gelatin; purified Water; Glycerin; Cholecalciferol (Vitamin D3); Lecithin (Soy)
https://dsld.od.nih.gov/label/19170,19170,A 8000 IU,Soybean Oil; Gelatin (Bovine); Fish Liver Oil; Glycerin; Retinyl Palmitate; Mixed Tocopherols
https://dsld.od.nih.gov/label/19173,19173,Balanced B-100,Dicalcium Phosphate; Hypromellose; Cellulose; Stearic Acid (C18:0); Contains <2% of: (Cellulose Coating; Maltodextrin; Mannitol; Silica; Vegetable Magnesium Stearate)
https://dsld.od.nih.gov/label/19188,19188,Fuel 7 Hour Energy Shot Fruit Flavor,Water; Natural & Artificial flavors; Sodium Bicarbonate; Potassium Sorbate; EDTA; Sucralose; Carmine Extract
https://dsld.od.nih.gov/label/19228,19228,Vitamin D 400 IU,Capsule (Gelatin); Glycerin; Soybean Oil
https://dsld.od.nih.gov/label/19289,19289,Vitamin D3 2000 IU,Rice Bran Oil; Gelatin; Glycerin; purified Water
https://dsld.od.nih.gov/label/19306,19306,Vitamin D3 2000 IU,Vegetable Glycerin; deionized Water; Orange natural flavor; Lemon essential Oil; Citric Acid
https://dsld.od.nih.gov/label/19310,19310,Key-E,Dextrose; Microcrystalline Cellulose; Corn Starch; Silicon Dioxide (SiO2); Magnesium Stearate; natural Vanilla flavor; Stevia
https://dsld.od.nih.gov/label/19544,19544,T.R.I.-B-Plex,Gelatin Capsule; Calcium Sulfate (Ca Sulfate); Food Glaze; Magnesium Stearate; Stearic Acid (C18:0); Ethylcellulose; Calcium Stearate; Polyethylene Glycol; Calcium Phosphate (Ca Phosphate); castor oil
https://dsld.od.nih.gov/label/19563,19563,Liquid Vitamin D3/K2,Medium Chain Triglycerides
https://dsld.od.nih.gov/label/19767,19767,B-12 Energy Booster Spearmint,purified Water; Vegetable Glycerin; Citric Acid; Potassium Sorbate; natural Spearmint flavor
https://dsld.od.nih.gov/label/19811,19811,Natural Vitamin E 400 IU,
https://dsld.od.nih.gov/label/19824,19824,Pantethine,Vegetable Cellulose; Glycerin
https://dsld.od.nih.gov/label/19877,19877,Vitamin A 8000 IU,Soybean Oil; Gelatin; Glycerin
https://dsld.od.nih.gov/label/19888,19888,Vitamin D 5000 IU,natural Vegetable Capsules; This product may contain one or more of the following: (Calcium Silicate; Magnesium Stearate; Microcrystalline Cellulose; Silicon Dioxide; Stearic Acid)
https://dsld.od.nih.gov/label/19892,19892,Vitamin D/K,Rice Bran; Gelatin
https://dsld.od.nih.gov/label/19960,19960,Vitamin E DL-Alpha 400 IU,DL-Alpha-Tocopheryl Acetate; Gelatin; Glycerin
https://dsld.od.nih.gov/label/19964,19964,Vitamin E 400 IU,DL-Alpha-Tocopheryl Acetate; Gelatin; Polysorbate 80; Glycerin
https://dsld.od.nih.gov/label/19965,19965,Vitamin D3 2000 IU,Soybean Oil; Gelatin; Glycerin; Corn Oil; Cod Liver Oil; Caramel color; Cholecalciferol (Vitamin D3)
https://dsld.od.nih.gov/label/19968,19968,Vitamin D3 4000 IU,Soybean Oil; Gelatin; Glycerin; Corn Oil; Cod Liver Oil; Cholecalciferol (Vitamin D3); Caramel color
https://dsld.od.nih.gov/label/19975,19975,Biotin 5000 mcg,Dicalcium Phosphate; Gelatin; Microcrystalline Cellulose; Hydroxypropyl Cellulose; Talc; Magnesium Stearate; Calcium Silicate; Sodium Lauryl Sulfate
https://dsld.od.nih.gov/label/19978,19978,Vitamin A & D3 10000-400 IU,Soy Oil; Gelatin; Glycerin; purified Water
https://dsld.od.nih.gov/label/19991,19991,Biotin 1000 mcg,Dicalcium Phosphate; Microcrystalline Cellulose; Magnesium Stearate; Silicon Dioxide (SiO2); Croscarmellose Sodium
https://dsld.od.nih.gov/label/20024,20024,Liquid D and K,Water; Medium Chain Triglycerides; Sunflower Oil; Cellulose; natural Vanilla flavor; Xanthan Gum; Potassium Sorbate; Stevia
https://dsld.od.nih.gov/label/20025,20025,Vitamin D3 Drops,organic Sesame Oil
https://dsld.od.nih.gov/label/20200,20200,Vitamin B Complex,Dicalcium Phosphate; Microcrystalline Cellulose; Pyridoxine Hydrochloride (Pyridoxine HCl); Calcium Pantothenate (Ca Pantothenate); Niacinamide; Thiamine Mononitrate; Croscarmellose Sodium; Stearic Acid (C18:0); Silicon Dioxide (SiO2); Magnesium Stearate; Dextrin; Dextrose; Lecithin; Sodium Carboxymethylcellulose; Sodium Citrate; Cyanocobalamin
https://dsld.od.nih.gov/label/20205,20205,Vitamin D3 1000 IU,Soybean Oil; Gelatin; Glycerin; Cod Liver Oil; Corn Oil; Caramel color; Cholecalciferol (Vitamin D3)
https://dsld.od.nih.gov/label/20265,20265,Sunvite Vitamin D3 1000 IU,Soybean Oil; Gelatin; Vegetable Glycerin; Corn Oil
https://dsld.od.nih.gov/label/20460,20460,Sunvite Chewable Vitamin D3 1000 IU,Sucrose; Sorbitol; Fructose; Xylitol; Vegetable Cellulose; Natural Flavors; Contains <2% of (Carmine color; Citric Acid; Malic Acid; Silica; Stearic Acid; Sucralose; Vegetable Magnesium Stearate)
https://dsld.od.nih.gov/label/20494,20494,Vitamin D3 2000 IU,Magnesium Citrate; Microcrystalline Cellulose
https://dsld.od.nih.gov/label/20509,20509,Folic Acid 800 mcg,Vegetable Cellulose; Dicalcium Phosphate; Contains <2% of (Silica; Vegetable Magnesium Stearate)
https://dsld.od.nih.gov/label/20535,20535,Vitamins A & D,Gelatin; Vegetable Glycerin; Contains <2% of (Mixed Tocopherols; Soybean Oil)
https://dsld.od.nih.gov/label/20568,20568,Sunvite Vitamin D3 2000 IU,Soybean Oil; Gelatin; Vegetable Glycerin; Corn Oil
https://dsld.od.nih.gov/label/20574,20574,Sunvite Vitamin D3 5000 IU,Soybean Oil; Gelatin; Vegetable Glycerin; Corn Oil
https://dsld.od.nih.gov/label/20578,20578,Vitamin B-12 Gummy Vitamins,Glucose Syrup; Sucrose; Gelatin; fractionated Coconut Oil; Natural flavor; Citric Acid; Lactic Acid; Beeswax
https://dsld.od.nih.gov/label/20603,20603,Vitamin A 10000 IU,Soybean Oil; Gelatin; Vegetable Glycerin; Fish Liver Oil
https://dsld.od.nih.gov/label/20604,20604,C-500 mg,Ascorbic Acid; Vegetable Cellulose; Contains <2% of (Silica; Stearic Acid; Vegetable Magnesium Stearate)
https://dsld.od.nih.gov/label/20671,20671,B-6 100 mg,Dicalcium Phosphate; Vegetable Cellulose; Silica; Contains <2% of (Stearic Acid; Vegetable Magnesium Stearate)
https://dsld.od.nih.gov/label/20675,20675,Vitamin E-1000 IU,Gelatin; Vegetable Glycerin; Soybean Oil
https://dsld.od.nih.gov/label/20694,20694,Sunvite Vitamin D3 2000 IU,Soybean Oil; Gelatin; Vegetable Glycerin; Corn Oil
https://dsld.od.nih.gov/label/20701,20701,100% Natural E-200 IU,Gelatin; Vegetable Glycerin; Soybean Oil
https://dsld.od.nih.gov/label/20702,20702,100% Natural E-400 IU,Gelatin; Vegetable Glycerin; Soybean Oil
https://dsld.od.nih.gov/label/20764,20764,Super Biotin 5000 mcg,Dicalcium Phosphate; Calcium Carbonate (Ca Carbonate; CaCO3); Gelatin; Silica; Vegetable Magnesium Stearate
https://dsld.od.nih.gov/label/20767,20767,Methylcobalamin B-12 5000 mcg,Mannitol; Vegetable Cellulose; Contains <2% of (natural Cherry flavor; Silica; Stearic Acid; Vegetable Magnesium Stearate)
https://dsld.od.nih.gov/label/20780,20780,Flush Free Niacin 500 mg,Gelatin; Stearic Acid (C18:0); Silica; Vegetable Magnesium Stearate
https://dsld.od.nih.gov/label/20788,20788,B12,Lactose (Milk); Cellulose; Croscarmellose Sodium; Magnesium Stearate
https://dsld.od.nih.gov/label/20840,20840,Sublingual B-12 2500 mcg,Mannitol; Crospovidone; Stearic Acid (C18:0); Natural flavor; Contains <2% of: (Beet Juice; Sucralose; Vegetable Magnesium Stearate)
https://dsld.od.nih.gov/label/20858,20858,Timed Release C-500 mg,Ascorbic Acid; Food Glaze; Gelatin; Sucrose; Magnesium Silicate; Corn Starch
https://dsld.od.nih.gov/label/20877,20877,Biotin 1000 mcg,Soybean Oil; Gelatin; Vegetable Glycerin; yellow Beeswax; Titanium Dioxide color
https://dsld.od.nih.gov/label/20883,20883,Timed Release Niacin 250 mg,Gelatin; Sucrose; Corn Starch; Food Glaze; Magnesium Silicate
https://dsld.od.nih.gov/label/20944,20944,Ultra Mega Biotin 10000 mcg,Soybean Oil; Gelatin; Vegetable Glycerin; yellow Beeswax; Titanium Dioxide color
https://dsld.od.nih.gov/label/21194,21194,Sunvite Vitamin D3 400 IU,Dicalcium Phosphate; Vegetable Cellulose; Stearic Acid (C18:0); Silica; Vegetable Magnesium Stearate
https://dsld.od.nih.gov/label/21424,21424,B12-2000,Sorbitol; Mannitol; Stearic Acid (C18:0); magnesium stearate; Natural flavor
https://dsld.od.nih.gov/label/21438,21438,Bio-E-Mulsion Forte,Gum Arabic; Sesame Oil
https://dsld.od.nih.gov/label/21511,21511,Bio-K-Mulsion,Water; Gum Arabic; Sesame Oil
https://dsld.od.nih.gov/label/21587,21587,Bio-Ae-Mulsion,Water and gum arabic emulsifier base; D-Alpha-Tocopherol
https://dsld.od.nih.gov/label/21589,21589,Bio-Ae-Mulsion Forte,Gum Arabic; D-Alpha-Tocopherol
https://dsld.od.nih.gov/label/21592,21592,Bio-D-Mulsion,Water; Gum Arabic; Sesame Oil
https://dsld.od.nih.gov/label/21595,21595,Fabb,Calcium Carbonate (Ca Carbonate; CaCO3); Microcrystalline Cellulose; Magnesium Stearate; Less than 1%: (Di-Acetylated Monoglycerides; Ethylcellulose; Macrogol; Oleic Acid; PEG; Triacetin)
https://dsld.od.nih.gov/label/21599,21599,Folcaps,Dicalcium Phosphate; Microcrystalline Cellulose; Croscarmellose Sodium; Stearic Acid (C18:0); Magnesium Stearate; Hydroxypropyl Methylcellulose; Polyethylene Glycol
https://dsld.od.nih.gov/label/21604,21604,Foltabs 800,Dicalcium Phosphate; Microcrystalline Cellulose; Croscarmellose Sodium; Silica; Stearic Acid (C18:0); Magnesium Stearate; Coating Ingredients (FD&C Blue #1 Aluminum Lake; FD&C Yellow #10 Aluminum Lake; FD&C Yellow #6 Aluminum Lake; Hypromellose; Polydextrose; Polyethylene Glycol; Titanium Dioxide; Triacetin)
https://dsld.od.nih.gov/label/21688,21688,Flax Seed Oil,Flax Seed Oil; Gelatin; Water; Glycerin; Carob; D-Alpha-Tocopherol
https://dsld.od.nih.gov/label/21709,21709,Vitamin C Ascorbic Acid,None
https://dsld.od.nih.gov/label/21713,21713,Vitamin B5 Pantothenic Acid,None
https://dsld.od.nih.gov/label/21757,21757,Vitamin E,Gelatin; Glycerin; purified Water
https://dsld.od.nih.gov/label/21856,21856,Folic Acid 1 mg,Cellulose; Dicalcium Phosphate; Croscarmellose Sodium; Magnesium Stearate; Silicon Dioxide (SiO2); Hypromellose; Glycerin
https://dsld.od.nih.gov/label/21871,21871,Vitamin B6 100 mg USP,Microcrystalline Cellulose; Dicalcium Phosphate; Croscarmellose Sodium; Stearic Acid (C18:0); Magnesium Stearate; Pharmaceutical Glaze
https://dsld.od.nih.gov/label/21872,21872,Vitamin D 400 IU,Microcrystalline Cellulose; Magnesium Stearate
https://dsld.od.nih.gov/label/21897,21897,Vitamin A 10000 IU,Gelatin; Glycerin; mineral oil; purified Water; Soy Lecithin; Soya Oil
https://dsld.od.nih.gov/label/21900,21900,Vitamin C 500 mg USP,Microcrystalline Cellulose; Calcium Phosphate (Ca Phosphate); Croscarmellose Sodium; Stearic Acid (C18:0); Silicon Dioxide (SiO2); Magnesium Stearate; Cellulose; Glycerin
https://dsld.od.nih.gov/label/21901,21901,Vitamin D 1000 IU,Cellulose; Magnesium Stearate
https://dsld.od.nih.gov/label/21907,21907,Vitamin E 400 IU USP,Soybean Oil; Gelatin; Glycerin
https://dsld.od.nih.gov/label/21993,21993,EZV 200 IU Vitamin E,Stearic Acid (C18:0); Silicon Dioxide (SiO2)
https://dsld.od.nih.gov/label/21996,21996,Lutein 10 mg,Maltodextrin; Magnesium Stearate; Gelatin; Titanium Dioxide
https://dsld.od.nih.gov/label/22010,22010,Multivits For Kids Strawberry Flavour,Sodium Ascorbate; Ascorbic Acid; Raspberry flavour; Beetroot Juice Powder; Dextrose; Silicon Dioxide (SiO2); Maltodextrin; Microcrystalline Cellulose; Magnesium Stearate
https://dsld.od.nih.gov/label/22029,22029,Vitamin D 400 IU,Dicalcium Phosphate; Microcrystalline Cellulose; Magnesium Stearate; Silicon Dioxide (SiO2)
https://dsld.od.nih.gov/label/22031,22031,Cod Liver 10 Minims,Glycerin; Gelatin
https://dsld.od.nih.gov/label/22034,22034,Cod Liver Oil 20 Minims,Soybean Oil; Glycerin; Gelatin
https://dsld.od.nih.gov/label/22039,22039,Norwegian Cod Liver Oil,
https://dsld.od.nih.gov/label/22040,22040,Pro Nutro Protein,Gelatin; Leucine
https://dsld.od.nih.gov/label/22082,22082,Niacin 100,Capsule shell (Gelatin; Water); Cellulose; Magnesium Stearate
https://dsld.od.nih.gov/label/22124,22124,B-Complex,Silica; Guar Gum; Vegetable Lubricant; Food Glaze
https://dsld.od.nih.gov/label/22147,22147,Vitamin E 400 IU,Gelatin; Glycerin; purified Water
https://dsld.od.nih.gov/label/22185,22185,Ergocalciferol,
https://dsld.od.nih.gov/label/22186,22186,L-Methylfolate Calcium 15 mg,Croscarmellose Sodium; Dicalcium Phosphate; Magnesium Stearate; Microcrystalline Cellulose; Silicon Dioxide (SiO2); Stearic Acid (C18:0); film coat (FD&C red #2; FD&C Yellow #6 Lake; Polyethylene Glycol; Polyvinyl Alcohol; Talc; Titanium Dioxide)
https://dsld.od.nih.gov/label/22191,22191,L-Methyl-MC,Dicalcium Phosphate; Microcrystalline Cellulose; FD&C Blue #1; Titanium Dioxide; Modified Cellulose; Croscarmellose Sodium; Stearic Acid (C18:0); Magnesium Stearate; Silicon Dioxide (SiO2); Polyethylene Glycol; Food Glaze
https://dsld.od.nih.gov/label/22222,22222,Thiamin 50,Gelatin; Water; Glycerin
https://dsld.od.nih.gov/label/22228,22228,Tocotrientols (From Rice),Gelatin; Glycerin; Water
https://dsld.od.nih.gov/label/22260,22260,Annatto Tocotrienols,Silicon Dioxide (SiO2); Microcrystalline Cellulose; Magnesium Stearates
https://dsld.od.nih.gov/label/22272,22272,Ultra B12-Folate,Microcrystalline Cellulose; Vegetable Stearate
https://dsld.od.nih.gov/label/22332,22332,B12 Folic Acid Spray Lipopure,deionized Water; Glycerin; Soy Lecithin; Sorbitol; Tocopherol (Vitamin E); Polysorbate 20; Spearmint Oil; Grapefruit seed extract; Stevia extract; Cellulose Gum; Potassium Sorbate; Citric Acid
https://dsld.od.nih.gov/label/22375,22375,Annatto Tocotrienols 125 mg,Gelatin; Glycerin; Water
https://dsld.od.nih.gov/label/22377,22377,A Plus Oil-Free Vitamin A And Beta Carotene,Beet powder; dehydrated Carrot powder; Gelatin; Turmeric; Silicon Dioxide (SiO2); Magnesium Stearate
https://dsld.od.nih.gov/label/22384,22384,Vitamin D3 2000 IU,Microcrystalline Cellulose; Magnesium Stearate
https://dsld.od.nih.gov/label/22401,22401,Vitamin D 400 IU,Dicalcium Phosphate; Microcrystalline Cellulose; Magnesium Stearate
https://dsld.od.nih.gov/label/22447,22447,Lutein 50 mg,HPMC Vegetarian Capsule (Titanium Dioxide); Magnesium Stearate
https://dsld.od.nih.gov/label/22510,22510,Lutein 10 mg,Maltodextrin; Magnesium Stearate; Gelatin; Titanium Dioxide
https://dsld.od.nih.gov/label/22525,22525,Pantethine,Microcrystalline Cellulose; Vegetable Stearate
https://dsld.od.nih.gov/label/22541,22541,Ultra Gamma E Complex,Bovine Gelatin; Glycerine; Rice Bran Oil; purified water
https://dsld.od.nih.gov/label/22542,22542,Vitamin D Complex with Vitamins A E K1 and K2,Microcrystalline Cellulose; Vegetable Stearate; Silicon Dioxide (SiO2)
https://dsld.od.nih.gov/label/22543,22543,Vitamin D Ultra 10K,Microcrystalline Cellulose; Vegetable Stearate
https://dsld.od.nih.gov/label/22544,22544,Vitamin D Synergy with Vitamin K1,L-Leucine; Microcrystalline Cellulose
https://dsld.od.nih.gov/label/22594,22594,Vitamin B12 250 mcg,Dicalcium Phosphate; Microcrystalline Cellulose; Silicon Dioxide (SiO2); Stearic Acid (C18:0); Magnesium Strearate
https://dsld.od.nih.gov/label/22599,22599,Folic Acid,Microcrystalline Cellulose; Vegetable Cellulose; Vegetable Stearate
https://dsld.od.nih.gov/label/22674,22674,Vitamin B12 Lozenges,Mannitol; Modified Cellulose; natural Berry flavor; Vegetable Stearate; Citric Acid; Luo Han Guo
https://dsld.od.nih.gov/label/22726,22726,Megabiotin 7500 mcg,Cellulose powder; Gelatin; Calcium Stearate; Silicon Dioxide (SiO2)
https://dsld.od.nih.gov/label/22828,22828,Liquid Vitamin D3,Vitamin E MTS-50; Sunflower Oil
https://dsld.od.nih.gov/label/22932,22932,Vitamin C From Tapioca,
https://dsld.od.nih.gov/label/22935,22935,Vitamin C-1000 From Tapioca,Gelatin; Magnesium Stearate
https://dsld.od.nih.gov/label/22937,22937,Vitamin C-1000 Non-Corn Source,Magnesium Stearate
https://dsld.od.nih.gov/label/22959,22959,Nialipin,Gelatin; Sucrose; Food Glaze; Magnesium Silicate
https://dsld.od.nih.gov/label/22985,22985,Pantethine Vitamin B5 Co-Enzyme,Microcrystalline Cellulose; Stearic Acid (C18:0); Silicon Dioxide (SiO2); modified Cellulose Gum; Magnesium Stearate; Povidone; Film coating ingredients (PEG 3350; Polysorbate 80; Polyvinyl Alcohol; Talc)
https://dsld.od.nih.gov/label/23027,23027,Vitamin E-400,Gelatin; Glycerin; Water
https://dsld.od.nih.gov/label/23029,23029,Ascorbic Acid (Vitamin C),None
https://dsld.od.nih.gov/label/23051,23051,Choline Bitartrate,None
https://dsld.od.nih.gov/label/23127,23127,Natural Vitamin E-400,Soybean Oil; Gelatin; Glycerin
https://dsld.od.nih.gov/label/23128,23128,Natural Vitamin A 10000 IU,Soybean Oil; Gelatin; Vegetable Glycerin; purified Water
https://dsld.od.nih.gov/label/23129,23129,Natural Mixed Tocopherol E-400,Soybean Oil; Gelatin; Glycerin; purified Water
https://dsld.od.nih.gov/label/23156,23156,Lutein 5%,Maltodextrin (Potato)
