URL,DSLD ID,Product Name,Other Ingredients
https://dsld.od.nih.gov/label/8755,8755,Vitamin E 200 IU Supplement,D-Alpha-Tocopherol; Gelatin; Glycerin; Water; Mixed Tocopherol concentrate; Soybean Oil
https://dsld.od.nih.gov/label/8756,8756,Pyridoxal-5-Phosphate,Cellulose; Gelatin; Vegetable Stearate
https://dsld.od.nih.gov/label/8759,8759,Vitamin E 400 IU Supplement,DL-Alpha-Tocopheryl Acetate; Gelatin; Glycerin; Water
https://dsld.od.nih.gov/label/8781,8781,Vitamin C 500 mg Supplement,Ascorbic Acid; Corn Starch; Cellulose Gel; Hydroxypropyl Cellulose; Stearic Acid (C18:0); Magnesium Stearate; Silicon Dioxide (SiO2)
https://dsld.od.nih.gov/label/8795,8795,Super B-Complex Supplement With Vitamin C,Dibasic Calcium Phosphate; Ascorbic Acid; Thiamine Mononitrate; Dried Yeasts; Cellulose Gel; Niacinamide; Croscarmellose Sodium; Calcium D-Pantothenate (Ca D-Pantothenate; Ca Pantothenate; Calcium Pantothenate); Hydroxypropyl Methylcellulose; Magnesium Stearate; Pyridoxine Hydrochloride (Pyridoxine HCl); Polyethylene Glycol; Cyanocobalamin
https://dsld.od.nih.gov/label/8799,8799,Super B-Complex Supplement With Vitamin C,Dibasic Calcium Phosphate; Ascorbic Acid; Thiamine Mononitrate; Dried Yeasts; Cellulose Gel; Niacinamide; Croscarmellose Sodium; Calcium D-Pantothenate (Ca D-Pantothenate; Ca Pantothenate; Calcium Pantothenate); Hydroxypropyl Methylcellulose; Magnesium Stearate; Pyridoxine Hydrochloride (Pyridoxine HCl); Polyethylene Glycol; Cyanocobalamin
https://dsld.od.nih.gov/label/8804,8804,Vitamin C 500 mg Supplement,Ascorbic Acid; Corn Starch; Cellulose Gel; Hydroxypropyl Cellulose; Stearic Acid (C18:0); Magnesium Stearate; Silicon Dioxide (SiO2)
https://dsld.od.nih.gov/label/8812,8812,Vitamin E 200 IU Supplement,DL-Alpha-Tocopheryl Acetate; Gelatin; Glycerin; Water
https://dsld.od.nih.gov/label/8814,8814,Vitamin E 400 IU Supplement,DL-Alpha-Tocopheryl Acetate; Gelatin; Glycerin; Water
https://dsld.od.nih.gov/label/8817,8817,Vitamin E 400 IU Supplement,DL-Alpha-Tocopheryl Acetate; Gelatin; Glycerin; Polysorbate 80; Water
https://dsld.od.nih.gov/label/8818,8818,Vitamin E 200 IU Supplement,D-Alpha-Tocopherol; Gelatin; Glycerin; Water; Mixed Tocopherol concentrate; Soybean Oil
https://dsld.od.nih.gov/label/8819,8819,Vitamin E 400 IU Supplement,D-Alpha-Tocopherol; Gelatin; Glycerin; Mixed Tocopherols; Water; Soybean Oil
https://dsld.od.nih.gov/label/8841,8841,Vitamin C 500 mg,Ascorbic Acid; Cellulose Gel; Corn Starch; Rose Hips; Hydroxypropyl Cellulose; Stearic Acid (C18:0); Magnesium Stearate; Silicon Dioxide (SiO2)
https://dsld.od.nih.gov/label/8843,8843,Vitamin C 1000 mg,Ascorbic Acid; Cellulose Gel; Corn Starch; Rose Hips; Hydroxypropyl Cellulose; Stearic Acid (C18:0); Hydroxypropyl Methylcellulose; Magnesium Stearate; Silicon Dioxide (SiO2); Polyethylene Glycol
https://dsld.od.nih.gov/label/8850,8850,Vitamin B-1 100 mg Supplement,Dibasic Calcium Phosphate; Thiamine Hydrochloride (Thiamine HCl); Cellulose Gel; Hydroxypropyl Methylcellulose; Magnesium Stearate
https://dsld.od.nih.gov/label/8851,8851,Vitamin B-6 50 mg,Dibasic Calcium Phosphate; Pyridoxine Hydrochloride (Pyridoxine HCl); Cellulose Gel; Croscarmellose Sodium; Magnesium Stearate
https://dsld.od.nih.gov/label/8854,8854,Vitamin B-12 250 mcg Supplement,Dibasic Calcium Phosphate; Cellulose Gel; Stearic Acid (C18:0); Croscarmellose Sodium; Magnesium Stearate; Cyanocobalamin
https://dsld.od.nih.gov/label/8856,8856,Vitamin E 400 IU Supplement,D-Alpha-Tocopherol; Gelatin; Glycerin; Mixed Tocopherols; Water; Soybean Oil
https://dsld.od.nih.gov/label/8860,8860,Beta Carotene,Corn Oil; Gelatin; Soybean Oil; Glycerin; Beta-Carotene; Water
https://dsld.od.nih.gov/label/8883,8883,Bio-Plus Biotin With Folic Acid,Cellulose; Gelatin; Vegetable Stearate
https://dsld.od.nih.gov/label/8900,8900,Super B-Complex Supplement With Vitamin C,Dibasic Calcium Phosphate; Ascorbic Acid; Thiamine Mononitrate; Dried Yeasts; Cellulose Gel; Niacinamide; Croscarmellose Sodium; Calcium D-Pantothenate (Ca D-Pantothenate; Ca Pantothenate; Calcium Pantothenate); Hydroxypropyl Methylcellulose; Magnesium Stearate; Pyridoxine Hydrochloride (Pyridoxine HCl); Polyethylene Glycol; Cyanocobalamin
https://dsld.od.nih.gov/label/8903,8903,B-Complex Supplement With Vitamin C,Ascorbic Acid; Cellulose Gel; Niacinamide; Hydroxypropyl Methylcellulose; Thiamine Mononitrate; Calcium D-Pantothenate (Ca D-Pantothenate; Ca Pantothenate; Calcium Pantothenate); Croscarmellose Sodium; Pyridoxine Hydrochloride (Pyridoxine HCl); Magnesium Stearate; Polyethylene Glycol
https://dsld.od.nih.gov/label/8904,8904,Super B-Complex Supplement With Vitamin C,Dibasic Calcium Phosphate; Ascorbic Acid; Thiamine Mononitrate; Dried Yeasts; Cellulose Gel; Niacinamide; Croscarmellose Sodium; Corn Starch; Calcium D-Pantothenate (Ca D-Pantothenate; Ca Pantothenate; Calcium Pantothenate); Hydroxypropyl Methylcellulose; Magnesium Stearate; Pyridoxine Hydrochloride (Pyridoxine HCl); Polyethylene Glycol; Cyanocobalamin
https://dsld.od.nih.gov/label/8906,8906,Super B-Complex Supplement With Vitamin C,Dibasic Calcium Phosphate; Ascorbic Acid; Thiamine Mononitrate; Dried Yeasts; Cellulose Gel; Niacinamide; Croscarmellose Sodium; Hydroxypropyl Methylcellulose; Calcium D-Pantothenate (Ca D-Pantothenate; Ca Pantothenate; Calcium Pantothenate); Magnesium Stearate; Pyridoxine Hydrochloride (Pyridoxine HCl); Polyethylene Glycol; Cyanocobalamin
https://dsld.od.nih.gov/label/8918,8918,Vitamin E 400 IU Supplement,DL-Alpha-Tocopheryl Acetate; Gelatin; Glycerin; Water
https://dsld.od.nih.gov/label/8922,8922,Sublingual - 12 Plus,Mannitol/fructose complex; Cellulose; Cherry flavor; Vegetable Stearate; Silica
https://dsld.od.nih.gov/label/8958,8958,Vitamin E 800 IU Supplement,D-Alpha-Tocopherol; Gelatin; Glycerin; Water; Mixed Tocopherol concentrate; Soybean Oil
https://dsld.od.nih.gov/label/8960,8960,Vitamin C 250 mg Supplement,Ascorbic Acid; Corn Starch; Cellulose Gel; Hydroxypropyl Cellulose
https://dsld.od.nih.gov/label/8961,8961,Vitamin C 500 mg,Ascorbic Acid; Corn Starch; Cellulose Gel; Hydroxypropyl Cellulose; Stearic Acid (C18:0); Magnesium Stearate; Silicon Dioxide (SiO2)
https://dsld.od.nih.gov/label/8962,8962,Vitamin C 500 mg,Ascorbic Acid; Corn Starch; Cellulose Gel; Hydroxypropyl Cellulose; Stearic Acid (C18:0); Magnesium Stearate; Silicon Dioxide (SiO2)
https://dsld.od.nih.gov/label/8963,8963,Vitamin C 500 mg,Ascorbic Acid; Corn Starch; Cellulose Gel; Hydroxypropyl Cellulose; Stearic Acid (C18:0); Magnesium Stearate; Silicon Dioxide (SiO2)
https://dsld.od.nih.gov/label/8965,8965,Vitamin C 1000 mg,Ascorbic Acid; Corn Starch; Cellulose Gel; Hydroxypropyl Cellulose; Hydroxypropyl Methylcellulose; Polyethylene Glycol
https://dsld.od.nih.gov/label/8966,8966,Vitamin C 1000 mg,Ascorbic Acid; Corn Starch; Cellulose Gel; Hydroxypropyl Cellulose; Stearic Acid (C18:0); Hydroxypropyl Methylcellulose; Magnesium Stearate; Silicon Dioxide (SiO2); Polyethylene Glycol
https://dsld.od.nih.gov/label/9073,9073,Natural Vitamin A Emulsified,Fish Liver Oil; Gelatin; lecithin (soya); Water
https://dsld.od.nih.gov/label/9074,9074,A-Potene 10,Gelatin; carrot oil; Water
https://dsld.od.nih.gov/label/9077,9077,Beta-Carotene Dry Capsules,Gelatin
https://dsld.od.nih.gov/label/9085,9085,Beta-Carotene Dry Capsules,Gelatin
https://dsld.od.nih.gov/label/9090,9090,Stress-Plex,Gelatin; Cellulose; Vegetable Stearate
https://dsld.od.nih.gov/label/9095,9095,Vitamin B-12 50 mcg,Cellulose; Vegetable Stearate; Silica
https://dsld.od.nih.gov/label/9097,9097,Soya Free E-200,Gelatin; Water
https://dsld.od.nih.gov/label/9098,9098,Natural Vitamin E 200 IU,Gelatin; Water
https://dsld.od.nih.gov/label/9109,9109,Orange-Chew 250 mg Chewable Vitamin C,Ascorbic Acid; Sodium Ascorbate; Fructose; Cellulose; orange flavor complex; Silica; Sorbitol; Vegetable Stearate
https://dsld.od.nih.gov/label/9115,9115,Vitamin D 400 IU Supplement,Calcium Carbonate (Ca Carbonate; CaCO3); Cellulose Gel; Stearic Acid (C18:0); Acacia; Maltodextrin; Croscarmellose Sodium; Magnesium Stearate; Corn Starch; Vitamin D3 (Cholecalciferol)
https://dsld.od.nih.gov/label/9121,9121,E-1000 Natural Vitamin E,Gelatin; lecithin (soya); Water
https://dsld.od.nih.gov/label/9130,9130,Vitamin E 400 IU Supplement,D-Alpha-Tocopherol; Gelatin; Glycerin; Mixed Tocopherol concentrate; Water; Soybean Oil
https://dsld.od.nih.gov/label/9154,9154,Niacin T.R. 400 mg,Cellulose; Gelatin
https://dsld.od.nih.gov/label/9160,9160,Cotrienol DG,Soy Lecithin; Rice Bran Oil; Gelatin; purified Water; Glycerin
https://dsld.od.nih.gov/label/9161,9161,Niacin T.R. 400 mg,Cellulose; Gelatin
https://dsld.od.nih.gov/label/9162,9162,Hi Potency Gamma Tocopherol With Vitamin E,Gelatin; Vegetable Glycerin; Soybean Oil; purified Water
https://dsld.od.nih.gov/label/9164,9164,Hi Potency Gamma Tocopherol With Vitamin E,Gelatin; Vegetable Glycerin; Soybean Oil; purified Water
https://dsld.od.nih.gov/label/9186,9186,Vitamin B-12 500 mg Supplement,Dibasic Calcium Phosphate; Cellulose Gel; Stearic Acid (C18:0); Croscarmellose Sodium; Magnesium Stearate; Cyanocobalamin
https://dsld.od.nih.gov/label/9190,9190,Vitamin B-6 100 mg Supplement,Pyridoxine Hydrochloride (Pyridoxine HCl); Dibasic Calcium Phosphate; Cellulose Gel; Croscarmellose Sodium; Stearic Acid (C18:0); Magnesium Stearate
https://dsld.od.nih.gov/label/9191,9191,Folic Acid 400 mcg Supplement,Dibasic Calcium Phosphate; Croscarmellose Sodium; Magnesium Stearate
https://dsld.od.nih.gov/label/9193,9193,Vitamin D 400 IU Supplement,Calcium Carbonate (Ca Carbonate; CaCO3); Cellulose Gel; Stearic Acid (C18:0); Acacia; Maltodextrin; Croscarmellose Sodium; Magnesium Stearate; Corn Starch; Vitamin D3 (Cholecalciferol)
https://dsld.od.nih.gov/label/9196,9196,Beta Carotene Supplement,Corn Oil; Gelatin; Soybean Oil; Glycerin; Beta-Carotene; Water
https://dsld.od.nih.gov/label/9197,9197,Vitamin E 400 IU Supplement,DL-Alpha-Tocopheryl Acetate; Gelatin; Glycerin; Polysorbate 80; Water
https://dsld.od.nih.gov/label/9200,9200,Super B-Complex Supplement With Vitamin C,Dibasic Calcium Phosphate; Ascorbic Acid; Thiamine Mononitrate; Dried Yeasts; Cellulose Gel; Niacinamide; Croscarmellose Sodium; Corn Starch; Calcium D-Pantothenate (Ca D-Pantothenate; Ca Pantothenate; Calcium Pantothenate); Hydroxypropyl Methylcellulose; Magnesium Stearate; Pyridoxine Hydrochloride (Pyridoxine HCl); Polyethylene Glycol; Cyanocobalamin
https://dsld.od.nih.gov/label/9201,9201,TRC 500 Timed-Release Vitamin C,Cellulose; Gelatin; Water
https://dsld.od.nih.gov/label/9216,9216,Tri-Niacin 250 mg Sustained Release Niacin,Cellulose; Gelatin
https://dsld.od.nih.gov/label/9219,9219,B-12 500 mcg Vitamin B-12 Tablet,Cellulose; Vegetable Stearate; Silica
https://dsld.od.nih.gov/label/9237,9237,Vitamin C Ester Ascorbyl Palmitate,Rice Flour; Microcrystalline Cellulose (Plant Fiber); Silica
https://dsld.od.nih.gov/label/9247,9247,Chewable Vitamin C 500 mg Supplement Natural Orange Flavor,Dextrose; Sodium Ascorbate; Ascorbic Acid; Natural Orange flavors; Magnesium Stearate; Corn Starch; Aspartame; Yellow 6 Lake
https://dsld.od.nih.gov/label/9279,9279,Numark Multivitamins,Soybean Oil; Gelatin; Ascorbic Acid; Glycerin; Niacinamide; DL-Alpha-Tocopheryl Acetate; Water; Calcium Pantothenate (Ca Pantothenate); Vitamin A Palmitate; Lecithin; Beeswax; Thiamine Mononitrate; Ethyl Vanillin; Pyridoxine Hydrochloride (Pyridoxine HCl); Titanium Dioxide; carob liquid
https://dsld.od.nih.gov/label/9302,9302,Orange-Chew 500 mg,Sodium Ascorbate; Ascorbic Acid; Fructose; Cellulose; orange flavor complex; Silica; Sorbitol; Vegetable Stearate
https://dsld.od.nih.gov/label/9307,9307,Orange-Chew 500 mg,Sodium Ascorbate; Ascorbic Acid; Fructose; Cellulose; orange flavor complex; Silica; Sorbitol; Vegetable Stearate
https://dsld.od.nih.gov/label/9312,9312,Orange-Chew 500 mg,Sodium Ascorbate; Ascorbic Acid; Fructose; Cellulose; orange flavor complex; Silica; Sorbitol; Vegetable Stearate
https://dsld.od.nih.gov/label/9321,9321,Pyridoxine-250,Cellulose; Gelatin; Vegetable Stearate
https://dsld.od.nih.gov/label/9323,9323,Pyridoxine-250,Cellulose; Gelatin; Vegetable Stearate
https://dsld.od.nih.gov/label/9330,9330,Vitamin C 500 mg Orange Chewable,Fructose; Sorbitol; natural Orange flavor; Orange juice crystals; microcrystalline cellulose magnesium stearate; Silica; natural Tangerine flavor; natural Pineapple flavor
https://dsld.od.nih.gov/label/9333,9333,Folic Acid With B-12 800 mcg,Magnesium Stearate; Cellulose; Vegetable Stearin; Dicalcium Phosphate; Silica
https://dsld.od.nih.gov/label/9335,9335,Vitamin E (Mixed Tocopherols) 400 IU,Gelatin; Glycerin; Water; May contain (Beeswax; Soybean Oil)
https://dsld.od.nih.gov/label/9359,9359,D-5000 5000 IU,Cellulose; Vegetable Stearate; Silica
https://dsld.od.nih.gov/label/9366,9366,vitamins A & D 10/4 (F.L. Oil),Capsules (Gelatin; Glycerin; Water); May contain (Beeswax; Soybean Oil)
https://dsld.od.nih.gov/label/9369,9369,B12 Vitamin 1000 mcg,Mannitol; Sorbitol; Dextrose; Sucrose; natural Cherry flavor; May contain one or more of the following (Cellulose; Magnesium Stearate; Silica; Vegetable Stearin)
https://dsld.od.nih.gov/label/9378,9378,Niacin 100 mg Nicotinic Acid,Cellulose; Vegetable Stearate; Silica
https://dsld.od.nih.gov/label/9408,9408,A-Potene 25,Carrot Oil; Gelatin; natural Glycerin; Water
https://dsld.od.nih.gov/label/9565,9565,Folic Acid,Microcrystalline Cellulose (Plant Fiber); Rice Flour; Ascorbyl Palmitate; Silica
https://dsld.od.nih.gov/label/9636,9636,ATP Cofactors Vitamins B-2 and B-3,Micosolle(R); Microcrystalline Cellulose; Stearic Acid (C18:0); Silicon Dioxide (SiO2); Croscarmellose Sodium; Magnesium Stearate; Pharmaceutical Glaze
https://dsld.od.nih.gov/label/9655,9655,Vitamin B-6 300 mg,Calcium Phosphate (Ca Phosphate); Calcium Stearate; Cellulose; Silica; Stearic Acid (C18:0)
https://dsld.od.nih.gov/label/9825,9825,Beta-A-Plus,Cellulose; Gelatin; Vegetable Stearate
https://dsld.od.nih.gov/label/9956,9956,Vitamin D3 2000 IU,Microcrystalline Cellulose (Plant Fiber); Rice Flour; Ascorbyl Palmitate; Silica
https://dsld.od.nih.gov/label/9998,9998,Natural Vitamin E Complex 400 IU,Soybean Oil; Gelatin; Water; Glycerin
https://dsld.od.nih.gov/label/10017,10017,Animal Shapes Kids' First,Sucrose; Sodium Ascorbate; Monoglycerides and Diglycerides; Ascorbic Acid; Gelatin; Mannitol; Maltodextrin; DL-Alpha-Tocopheryl Acetate; Silicon Dioxide (SiO2); Niacinamide; Stearic Acid (C18:0); Corn Starch; Natural and Artificial Flavors (Artificial Pineapple; Natural & Artificial Cherry; Natural & Artificial Fruit Punch; Natural Orange); Magnesium Stearate; Red 40 Lake; Pyridoxine Hydrochloride (Pyridoxine HCl); Riboflavin; Yellow 6 Lake; Thiamine Mononitrate; Beta-Carotene; Mono Ammonium Glycyrrhizinate; Blue 2 Lake; Vitamin A Acetate; Dicalcium Phosphate; Lactose; Ethylmaltol; Ergocalciferol; Cyanocobalamin
https://dsld.od.nih.gov/label/10018,10018,Multiple Vitamins Essential,Calcium Carbonate (Ca Carbonate; CaCO3); Ascorbic Acid; Gelatin; DL-Alpha-Tocopheryl Acetate; Niacinamide; Cellulose; Calcium D-Pantothenate (Ca D-Pantothenate; Ca Pantothenate; Calcium Pantothenate); Croscarmellose Sodium; Silicon Dioxide (SiO2); Acacia; Dextrin; Hypromellose; Crospovidone; Corn Starch; Stearic Acid (C18:0); Pyridoxine Hydrochloride (Pyridoxine HCl); Polyethylene Glycol; Red 40 Lake; Magnesium Stearate; Riboflavin; Thiamine Mononitrate; Vitamin A Acetate; Dextrose; Resin; Titanium Dioxide; Soy Lecithin; Beta-Carotene; Blue 2 Lake; Ergocalciferol; Cyanocobalamin
https://dsld.od.nih.gov/label/10081,10081,Vitamin C 1000 mg (Corn Free),Ascorbic Acid; Cellulose; Vegetable Stearate; Silica
https://dsld.od.nih.gov/label/10084,10084,Vitamin C Fine Powder USP,
https://dsld.od.nih.gov/label/10112,10112,Multi-E-400 Natural (Dry),Cellulose; Gelatin; Silica; Vegetable Stearate
https://dsld.od.nih.gov/label/10262,10262,Dicobalene-V Cherry Flavored,Unidex (Dextrose; Agglomerated); Beta-Cyclodextrin; Sodium starch glycolate; Magnesium Stearate; Naturally Sweet(TM) Cherry flavor; Silica
https://dsld.od.nih.gov/label/10326,10326,Super Sublingual B-12 Folate,Mannitol/sucrose complex; Cellulose; Cherry flavor; Vegetable Stearate; Silica
https://dsld.od.nih.gov/label/10485,10485,Aqua-E Water-Soluble Vitamin E Tocopherols + Tocotrienols,Water; d-alpha-tocopheryl polyethylene glycol-1000 succinate (TPGS); Potassium Sorbate; Sorbic Acid; Linoleic Acid (C18:2n-6; LA)
https://dsld.od.nih.gov/label/10486,10486,Aqua-E Water-Soluble Vitamin E Tocopherols + Tocotrienols,Water; d-alpha-tocopheryl polyethylene glycol-1000 succinate (TPGS); Potassium Sorbate; Sorbic Acid; Linoleic Acid (C18:2n-6; LA)
https://dsld.od.nih.gov/label/10596,10596,B-Sure Complex,Cellulose; Vegetable Stearate; Silica
https://dsld.od.nih.gov/label/10709,10709,D-Sorb With Vesisorb Technology,Cellulose; Medium Chain Triglycerides; Polysorbate 80; Sucrose Fatty Acid Ester; Fatty Acids; Vitamin E (DL-Alpha-Tocopherol); Silica
https://dsld.od.nih.gov/label/10854,10854,Vitamin E,Soybean Oil; Gelatin; Glycerin; Water
https://dsld.od.nih.gov/label/11039,11039,Beta Carotene 25000 IU,refined Soybean Oil; Gelatin; Glycerin; purified Water
https://dsld.od.nih.gov/label/11068,11068,Chewable C-250,Sucrose; Stearic Acid (C18:0); Fructose; Sorbitol; Cellulose; Silicon Dioxide (SiO2); Magnesium Stearate; natural Orange flavor; Sucralose; FD&C Yellow #6
https://dsld.od.nih.gov/label/11208,11208,E-200,Gelatin; Glycerin; refined Soybean Oil; purified Water
https://dsld.od.nih.gov/label/11210,11210,Blended E-400,Gelatin; Glycerine; refined Soybean Oil
https://dsld.od.nih.gov/label/11213,11213,E-400,Gelatin; Glycerin; refined Soybean Oil; purified Water
https://dsld.od.nih.gov/label/11221,11221,Natural E-1000,refined Soybean Oil; Gelatin; Glycerin; purified Water
https://dsld.od.nih.gov/label/11446,11446,Liposomal Vitamin C Softgels,Phospholipids; Coconut Oil; Sesame Oil
https://dsld.od.nih.gov/label/11503,11503,Vital C Crystal Powder,
https://dsld.od.nih.gov/label/11643,11643,Zoo Friends with Xtra C,Sucrose; Sorbitol; Stearic Acid (C18:0); Silicon Dioxide (SiO2); Cellulose; Natural Flavors; Magnesium Stearate; Sucralose; Artificial Colors Added (FD&C Blue #2; FD&C Red #40; FD&C Yellow #6)
https://dsld.od.nih.gov/label/11756,11756,PrimAge 220,Magnesium Stearate; Gelatin
https://dsld.od.nih.gov/label/11762,11762,Folic Acid 800 mcg,Cellulose; Stearic Acid (C18:0); Magnesium Stearate
https://dsld.od.nih.gov/label/11819,11819,Vitamin E Mixed 400,Gelatin
https://dsld.od.nih.gov/label/11832,11832,Xobaline Methyl B-12 3,Maltodextrin; Fructose; Stearic Acid (C18:0); Croscarmelose Sodium; Magnesium Stearate; Silicon Dioxide (SiO2); Cherry flavor
https://dsld.od.nih.gov/label/11834,11834,Folic Acid Folate 5,Microcrystalline Cellulose; Gelatin
https://dsld.od.nih.gov/label/11836,11836,Biotin 5,Dicalcium Phosphate gr.; Croscarmelose Sodium; Stearic Acid (C18:0); Magnesium Stearate; Cellulose
https://dsld.od.nih.gov/label/11845,11845,Benfotiamine Lipid-soluble Vitamin B-1 150,Magnesium Stearate; Gelatin
https://dsld.od.nih.gov/label/12008,12008,Timed Release C - 1000 mg With Rose Hips,Di-Calcium Phosphate; Cellulose; Mag. Stearate; Stearic Acid (C18:0)
https://dsld.od.nih.gov/label/12016,12016,D3 2000 IU,Soybean Oil; Gelatin (Bovine); Glycerin; Corn Oil
https://dsld.od.nih.gov/label/12097,12097,Vitamin B1,Dicalcium Phosphate; Stearic Acid (C18:0); Silicon Dioxide (SiO2); Magnesium Stearate; Croscarmellose Sodium
https://dsld.od.nih.gov/label/12170,12170,Balanced B-100 Complex,Dicalcium Phosphate; Calcium D-Pantothenate (Ca D-Pantothenate; Ca Pantothenate; Calcium Pantothenate); Thiamine Mononitrate; Pyridoxine Hydrochloride (Pyridoxine HCl); Hypromellose; Riboflavin; Niacinamide; Cellulose; Stearic Acid (C18:0); Mannitol; Silica; Magnesium Stearate; Maltodextrin; Cellulose Coating; Cyanocobalamin; D-Biotin
https://dsld.od.nih.gov/label/12177,12177,Vitamin D 1000 IU,Dicalcium Phosphate; Microcrystalline Cellulose; Croscarmellose Sodium; Stearic Acid (C18:0); Magnesium Stearate; Cholecalciferol
https://dsld.od.nih.gov/label/12187,12187,Vitamin D 400 IU,Dicalcium Phosphate; Microcrystalline Cellulose; Croscarmellose Sodium; Stearic Acid (C18:0); Magnesium Stearate; Cholecalciferol
https://dsld.od.nih.gov/label/12232,12232,Timed Release Niacin 750 mg,Lactose; Hypromellose; Stearic Acid (C18:0); Titanium Dioxide; Magnesium Stearate; Magnesium Silicate; Triacetin; mineral oil; Sodium Lauryl Sulfate
https://dsld.od.nih.gov/label/12234,12234,Natural E-400 IU D-Alpha Tocopheryl,Gelatin; Soybean Oil; Vegetable Glycerin
https://dsld.od.nih.gov/label/12253,12253,Lutein,Vegetable oil; Gelatin; Glycerin; yellow Beeswax; Soy Lecithin
https://dsld.od.nih.gov/label/12272,12272,Vitamin D 400 IU,Soybean Oil; Gelatin; Glycerin; purified Water
https://dsld.od.nih.gov/label/12274,12274,Men's Essential Vitamins,Dicalcium Phosphate; Microcrystalline Cellulose; Stearic Acid (C18:0); Gelatin; Croscarmellose Sodium; Starch; Magnesium Stearate; Hypromellose; Silica; Magnesium Silicate; Sucrose; FD&C Red #40 Lake; Polyethylene Glycol; mineral oil; Polyvinylpyrrolidone; Sodium Ascorbate; Titanium Dioxide; Triglycerides; Mixed Tocopherols; Glucose; FD&C Yellow #6 Lake; Sodium Benzoate; Sorbic Acid; BHT
https://dsld.od.nih.gov/label/12382,12382,Ultra E,Rice Flour; Gelatin
https://dsld.od.nih.gov/label/12423,12423,A & D 10000 IU / 400 IU,Gelatin; Glycerin; Soybean Oil
https://dsld.od.nih.gov/label/12505,12505,Vitamin A&D 10000-400 IU,Microcrystalline Cellulose; Di-Calcium Phosphate; Stearic Acid (C18:0); Magnesium Stearate; lemon grass oil; Riboflavin; Pharmaceutical Glaze; Silica
https://dsld.od.nih.gov/label/12506,12506,Vitamin A 10000 IU,Soy Oil; Gelatin; Glycerin; purified Water
https://dsld.od.nih.gov/label/12581,12581,Liquid B Complex With Iron,Water; Honey; Blackstrap Molasses; Ginseng; Beet; fo-ti; gotu kola
https://dsld.od.nih.gov/label/12595,12595,Vitamin B-2 250 mg,Microcrystalline Cellulose; Hydroxypropyl Methylcellulose; Di-Calcium Phosphate; Stearic Acid (C18:0); Rice Bran; Magnesium Stearate; Pharmaceutical Glaze; Silica
https://dsld.od.nih.gov/label/12600,12600,Vitamin B-6 100 mg,Microcrystalline Cellulose; Silica; Rice Bran; Vegetable Cellulose; purified Water
https://dsld.od.nih.gov/label/12700,12700,High Potency Antioxidant Vitamin C 500 mg,Microcrystalline Cellulose; Silica; Vegetable Cellulose; purified Water
https://dsld.od.nih.gov/label/12768,12768,Vitamin E 200 IU,Soy Oil; Gelatin; Glycerin; purified Water
https://dsld.od.nih.gov/label/12864,12864,Super Nutri Mega Potency,Microcrystalline Cellulose; Dicalcium Phosphate; Gelatin; Soybean Oil; Silica; Rose Hips; Croscarmellose Sodium; Stearic Acid (C18:0); Magnesium Stearate; Calcium Sulfate (Ca Sulfate); Glycerine; Water; Pharmaceutical Glaze; Carnauba Wax; Hydroxypropyl Methylcellulose
https://dsld.od.nih.gov/label/12921,12921,Earth Sweet Chewable Vitamin B-12 & Folic Acid Natural Raspberry Flavor,natural Raspberry flavor; natural Strawberry flavor; EarthSweet (Cane Crystals; Juice Concentrates); Stearic Acid (C18:0); Vegetable Cellulose; Vegetable Magnesium Stearate
https://dsld.od.nih.gov/label/12953,12953,Allergy A & D3,Potato Starch; Rice Bran defatted extract; Gelatin; Silica; Magnesium Stearate; Medium Chain Triglycerides
https://dsld.od.nih.gov/label/13041,13041,Gummie Multi Vitamin Daily Formula,Glucose Syrup (Corn); Sucrose; Gelatin; Natural Flavors; Citric Acid; Lactic Acid; Color (Annatto; Carrot and Blueberry Juices; Turmeric); Fractionated Coconut Oil (Beeswax; Carnauba wax); Beeswax
https://dsld.od.nih.gov/label/13096,13096,E-400 100% Natural D-Alpha Tocopheryl,Vegetable Oil concentrate; Gelatin; Glycerin; Water
https://dsld.od.nih.gov/label/13100,13100,E-400 100% Natural Mixed Tocopherols,Vegetable Oil concentrate; Gelatin; Glycerin; Water
https://dsld.od.nih.gov/label/13132,13132,Biotin 5 mg,Dicalcium Phosphate; Gelatin; Stearic Acid (C18:0)
https://dsld.od.nih.gov/label/13167,13167,Timed Release B-100 B-Complex Vitamins,Calcium Sulfate (Ca Sulfate); Stearic Acid (C18:0); Calcium D-Pantothenate (Ca D-Pantothenate; Ca Pantothenate; Calcium Pantothenate); Niacinamide; Pyridoxine Hydrochloride (Pyridoxine HCl); Thiamine Mononitrate; Hydroxypropyl Methylcellulose; Microcrystalline Cellulose; Silicon Dioxide (SiO2); Choline Bitartrate; Inositol; Para Amino Benzoic Acid; Magnesium Stearate; Silicon Dioxide; Colloidal; Brewer's Yeast powder; Folic Acid; Polyethylene Glycol; Carnauba Wax; Cyanocobalamin; Talc; Alfalfa powder; Watercress powder
https://dsld.od.nih.gov/label/13185,13185,Forever B12 Plus,Dextrose; Dicalcium Phosphate; Hydroxypropyl Methylcellulose; Microcrystalline Cellulose; Stearic Acid (C18:0); Silica; Magnesium Stearate
https://dsld.od.nih.gov/label/13246,13246,Fast Acting Liquid Vitamin D3 Tropical Blend,purified Water; natural Vegetable Glycerin; Natural Flavors; Citric Acid; Sodium Citrate; Potassium Sorbate
https://dsld.od.nih.gov/label/13267,13267,Cod Liver Oil Vitamin A & D Supplement,Cod Liver Oil
https://dsld.od.nih.gov/label/13269,13269,D3 400 IU,Soybean Oil; Gelatin; Glycerin
https://dsld.od.nih.gov/label/13331,13331,Biotin 1000 mcg Natural Orange Flavoring,Sorbitol; natural Orange flavoring; Cellulose; Silica; Magnesium Stearate; Natural Carotene Coloring
https://dsld.od.nih.gov/label/13390,13390,Vitamin B-1,Whole Food Base (Whole Rice Concentrate); Gelatin Capsule; Magnesium Stearate
https://dsld.od.nih.gov/label/13421,13421,Maxi Baby Care,purified Water; Glycerin; Fructose; mixed fruit concentrate (Peach; Pear; Pineapple); Citric Acid; natural Raspberry flavor; Xanthan Gum; Potassium Sorbate; Sodium Benzoate
https://dsld.od.nih.gov/label/13460,13460,Vitamin B3 Niacin 1000 mg,Gelatin; Vegetable Stearate
https://dsld.od.nih.gov/label/13467,13467,Liquid Vitamin D3 5000 IU,Sunflower seed Oil; natural Orange flavor; Vegetable oil
https://dsld.od.nih.gov/label/13471,13471,Vitamin D3 2000 IU Liquid Emulsion,Vegetable Glycerin; deionized Water
